URL_ID|카페명|리뷰
1943025765|고양이정원|$$$$$$$$잘 운영되던 곳 뺏어서 분양업으로 망쳐놓은 곳…$$주말에 사람이 진짜 많더라구요 이른 시간인데도 사람이 정말 많구 (점점 많아짐ㅋㅋ) 주차장이 많이 협소해요 관리하시는 분이 주차1 카운터2-3 이시던데 밀려드는 사람들 때문에 돌아다니시는건 못봤네요;; 분위기는 되게 자유롭고 낮엔 애들이 많이 늘어져있어 장난감말고 돗자리+담요 추천합니다 그럼 애들이 푹신한데 알아서 찾아와요 이름 알아듣는 아이들도 많아서 이...
1688973510|카페우드진|$$$$제가 갔을 땐 여자알바생 분이 계셨는데 친절하셨어요! 커피는 맛있었는데 디저트는 쏘쏘였습니다$$커피가 맛있습니다$$분위기 좋음용$$한라봉얼그레이 맛있었어요$$주문받는 분 친절하시고 밀크티 향이 참 좋아요 $$$$다들 엄청 친절하던데  불편하게 사는 인간들 진짜 많네$$$$T2 보고 빵 터짐 카페든 커피든 전체적으로 너무 어설픔$$불친절하다는 후기가 있었는데 진짜 불친절함ㅋㅋㅋㅌㅌㅋㅋㅋㅋㅋ$$$$여자알바님 너무 친절하시고 귀여워요 쿠키도 맛잇음$$불친절..$$$$자주 가는데 항상 친절하시고 맛도 좋고 분위기 있습니다. 만족합니다.$$글쎄요... 평보고 찾아가보았는데 맛이 별로였어요. ㅠ  야외 분위기는 좋아요. 주차시스템도 괜찮구요. $$분위기 괜찮고 케이크 맛있는데  라떼는 별로였고, 진짜 불친절ㅋㅋㅋ  직원분이 대답을 안해요; 벙어린줄$$불친절함$$$$차도 t2로 들여놓으시고 한 거 보면 정말 호주식으로 하시려고 노력하신 것 같은데 커피는 그냥 그렇네요... 너무 묽어요 매장에서는 안 먹어봐서 어떤 잔에 주시는지 모르겠지만요 소이밀크도 아쉽네요  그리고 직원분이 불친절했습니다.$$+우디쑥페너 양은 작지만 맛있음.$$그냥 그래요.. $$$$맛있어요!$$커피도 맛있고 나무느낌 분위기도 좋은 카페.$$
23149226|뚜스뚜스 등촌점|$$시끄러워요$$가까운 곳에 위치해 자주가던 카페이긴 했는데 왜인지 일하는 사람이 바뀌어도 대부분 예의가 없음 과한 친절 서비스를 바라는 건 아니지만 일부러 사람을 불쾌하게 할 정도의 태도를 보임 치즈케익 해동이 전혀 안된상태로 제공 됨 너무 딱딱해서 먹기 힘들다고 카운터에 말하니 케익이 얼었으면 녹여서 드셔야죠라는 답변만.. 소비자 심리 실험 현장인가.. 아직 까지 영업...$$인테리어 예쁘고 음료는 무난해요. 요샌 어떤지 모르겠는데 항상 시끌벅적해서 1층에서 카공 절대 못함 딱히 친절/불친절하다고 느낀 적은 없었음$$오믈렛에서 휴지 조각이 나왔어요! 그릇을 주방에 드렸는데, 글쎄 양배추라는 거예요.. 사진을 미리 찍어놔서, 다시 확인해 봐도 뚜스뚜스에서 사용하는 그 흰색 휴지의 질감이 그대로 살아있는데ㅋㅋㅋ 차라리 이물질이 들어간 것 같다고 사실대로 말해주셨으면 괜찮았을 텐데 양배추 발언에 실소가 나왔어요ㅠㅠ 비용은 환불받았고, 이물질도 이물질이지만 응대 때문에 재방문...$$$$여기 아주 예전부터 가끔 갔는데 직원분들 불친절 해요. 친절 하진 않아도 불친절 하면 안되죠.. 시크한척 하는건지 암튼 그렇습니다. 음식이랑 음료는 소소이고..$$직원들은 잘 모르겠고 커피랑 음식 맛있어서 갑니다$$재방문 의사없게 만드는 불친절한 서비스$$직원 불친절 참아가며 다시 방문할 정도의 맛집 아니라서 재 방문 의사 없습니다$$맛있어용 친절하심$$제가 실수해서 음료르 엎었는데 너무 친절히 응대해주셨어요 너무 죄송했었는데 음료도 다시준비해주셨고 맛도 정말 맛있었습니다!!$$빵은 맛있는데 파스타는 그냥 그럼. 무엇보다 갈색머리 남자직원 퉁명스러워서 기분나쁘다. 실수해놓고 다른직원이 상황 설명해주고나서야 대충 사과함$$2층에는 벌레관리도 안하는지 벌레 시체랑 모기 파리할거없이 날아다니고 먼지 엄청 쌓여있는데 직원들이 청소한번 안하나봄 $$빵 자르는거 진짜 대충, 던져놓듯이 접시에놓음 ㅋㅋㅋㅋㅋ서비스 불친절 손님이랑 싸우자는건가 $$직원 대응이 별로고 항상 사람이 너무 많아서 정신 없는 곳 $$뚜스뚜스 맛있음$$녹차 크로아상 맛있음$$$$카페가 커서 좋다. 음료는 그냥 기본. 서비스도 기본$$+리코타과일샐러드, 배달. 5점.  +무화과잼 초리죠 샌드위치. 배달. 5점. +바질 치즈 치아바타. 배달. 5점. +잠봉샌드위치. 배달. 3점. +퀸아망. 배달. 5점. +파스타루꼴라샐러드. 배달. 4점.$$케이크 너무 맛있어요 진짜 10만원 넘게 쓴 듯 직원분들도 엄청 친절하셔서 나갈때 서로 계속 인사하며 나갔네요ㅋㅋㅋㅋ$$강서구에 파스타 여기만큼 하는곳 없네요. 자주 갑니다!$$11/15 일요일 점심시간 1시에 뚜스뚜스 등촌점에서  생과일쥬스 자몽과 토마토 를 주문하고 음료를 마셨는데 자몽쥬스 안에서 손톱같은 이물질이 나왔습니다. 매니저는 고무장갑이 잘린것이라며 음료를 교환해 준다고 했고 저는 취소를 요청했습니다. 고객 입에 이물질은 넣고도 사과도 없이 마무리를 하려고 하자 매장을 떠나며 사장께 연락하라는 멘트를 남기고 명함을 주...$$$$커피랑 음료수는 맛있는데 , 음식은 솔직히 맛있는지는 모르겠다 $$헤이즐넛 라떼 맛있어요 음식들도 맛있는데 오래 걸리는듯해요$$알바들 느리긴 하네요 매장 규모나 맛에 비해서 서비스는 별로 입니다 사람 많아서 손님 좀 줄어야 정신차릴거 같네요$$녹차 그로와상 짱이네요. 너무 맛있으니까 또 가야곘네요$$(수정) 리뷰쓰고 일년가까이 지났는데 여전히 불친절 특히 주말 남자 알바 커피 만들면서 마스크는 턱에 쓰고 직원끼리 노닥거림 ———————————————- 직원들 진짜 불친절... 사장님이 엄청 부려먹나요..? 왤케 불친절한지 모르겠어요. $$이 동네에 오래살아서 여러번 가봣지만, 갈수록 친절이라곤 없네요. $$집앞이라 파스타 먹고왔어요 맛 4 분위기 3(주말에는 매우 시끄럽 시장통 연상) 친절도 3(서빙하는 직원 1분이 대답도 안하고 손짓으로 응대하시네요)$$외관에 비해 인적관리를 잘 못한다ㅡ운영자가 CS경험 전무하고 돈으로 미시는듯. 골프장손님들이랑 전철인근이라 그나마 손님은 많네$$불친절하다는 댓글 보고 갔지만 정말 불친절하네요 ㅋㅋ 알바 교육 다시 시켜야 할듯.. 말투에 짜증이 가득하고 손님이 전혀 반갑지 않고 주문 안하고 나갔으면 좋겠다는 식의 태도..$$전반적으로 괜찮은데 정말 직원(알바)교육 제대로 해야됨. 뭐 지금 당장 장사 잘된다고 이대로가면 얼마 못가서 망할꺼 같음. $$칸막이 자리 쟁탈... 거의 못앉지만... 빵 맛있어요 식사류도 맛있고 ~$$공간이 너무 소란스러워요. 넓어서 작업하기 좋을 수 있을진 모르겠지만 2층 좌석은 천장이 너무 낮아서 답답하고요. 하여간 매우 소란스러움. 차 종류가 많은건 좋습니다$$위치도 좋고 다 좋은데 직원분들 너무 불친절해서 가기 싫어지는 곳이에요. 주문하려고 해도 핸드폰 보면서 할 거 다 하고 주문 받고, 말투도 너무 틱틱거리더라구요. 노트북 하기 좋고 위치 좋은 점 빼고는 가고 싶은 생각이 전혀 안드는 곳이에요.$$그냥그래요$$빵 4종류를 담아서 썰어줬는데 두종류 마냥 나왔네요. 빵을 원래 이렇게 썰어 주냐고 물어봤더니, 직원왈 "썰다보면 이렇게 돼요" 라고하네요.$$빵하고 커피는 맛있는집~  직원들이 친절 했음 합니다. 시비조로 말하는게 습관인거 같습니다, 손님이랑 뭐 해보자는건지,,,  일요일 오전에 일하던 카운터 남자1,여자1 좀 교육시키세요. 직원들끼리는 얘기할때 표정도 좋고 웃던데 손님들 앞에서는 무표정에 무뚝뚝...$$좋아요$$$$$$$$$$$$전체적인 매장 리뉴얼로 새로 바뀐 분위기도 좋고 커피도 제가 좋아하는 맛이어서 좋았습니다 빵은 먹어보지 못했지만 다음에 가면 빵도 먹어보고싶은 비주얼이었습니다 $$전에는 커피도 맛있고 친절한 직원도 많고했는데 간만에왔더니 아메리카노도 맥도날드처럼 밍밍한맛이고 친절하지도 않았네요...$$다 좋은데 바리스타 분들  불친절$$맛은 괜찮으나 가격이 좀 비싼듯합니다. $$
16682720|고양이똥|$$아란치니 뱅쇼 아보카도 오픈샌드위치 먹었어요. ㅠㅠ 다 맛있었어요. 뱅쇼는 뜨끈하게 마시니까 건강하게 속이 데워지는 느낌이 들어서 너무 뜨끈하고 좋았어요. 다음에 또 먹으러 갈게요! $$이 동네에서 왜 유명한지 알겠다$$카페지만 파스타도 팔아서 좋음$$$$파스타가 느끼하지도 않고 면도 알단테하고 맜있다 해산물도 많고 간도 적당함 이 정도 퀄에 이 정도 가격이면 또 방문 에그베네딕트도 부드럽고 맛있고 햄도 훌륭 아란치니 역시 간도 잘 맞고 훌륭하다
851969193|브루클린커피|$$크로플 맛나요$$커피랑 빵 맛있어요:)$$커피맛있구 친절해여$$라떼는 꼭 베퍼드로 먹어요 꼬숩고 맛있어요  앙스콘도 왕크고 맛있어서 좋아요 매장 분위기도 따숩따숩 $$$$댓글알바?$$디저트가 맛있어요!$$누네띠로플 존맛…… 라떼가 맛있는집이네요!$$커피는 맛있는데 디저트, 매장 청결도가 별로였어요.. 디저트 비주얼이 좋아서 그런지 기대를 너무 많이 했나봄.. $$$$쑥크림라떼 짱 맛있어요$$산미있는거 좋아하는데 베퍼드? 맛있네요~$$아메리카노....... 왜 이래$$카페를 좋아해서 많이 다니는데 이곳 브루클린 커피는 항상 저에게 고급진 맛을 선사해주시네요. 잘 이용하고 있습니다.$$커피가 너무 맛있어요!!!!!!! 크로플이랑 같이 먹으니까 굿굿 처음가봤는데 분위기도좋고 친절하게 설명해주ㅅㅕ서 재방문 할거에여~$$최강 크로플 ㅜㅜ♡ 진짜 맛있어요 딱 여성분들이 좋아할만한 카페에요!! 다 맛있어보여서 직원분들께 추천해달라는 민폐... 를 끼쳤지만 너무너무 친절하게 잘 답변해주셨습니다!! 꼭 한번 가보세요 ~~$$커피,빵 분위기 맛집 :D$$커피, 디저트.. 다 맛있어서 발산가면 꼭 들렀다 옵니당ㅎㅎ밀크티도 존맛!!$$직원들 친절하고 카페 분위기도 최고입니다$$카페분위기도 너무좋고 디저트도 취향저격ㅠㅠ 원래 커피 잘 안마시는데 이상하게 여기만 계속 찾아서 마시게 돼여,,,사람을 이끄는 마약같은 카페인거같아요ㅎㅎ 직원분들 적게 일하고 많이 버세요!!!♡$$직원분이 베퍼드라때 추천해주셨는데 완전 제입맛에 찰떡!!!     같이 먹은 크로플도 존맛탱이에요ㅠㅠㅠ$$커피맛있어요~~$$커피랑 디저트 종류 많고 맛있었어요 !! :) 특히 쿠키가 너무 맛있어서 포장까지 해왔네요 직원분들도 친절하시고 다음에 또 갈 예정입니당$$저렴한 가격으로 직접만든 디저트와 맛있는커피를 즐길 수 있는 곳이에요!! 직원분들도 너무 친절하고 친구들과 즐거운 시간 보내다 왔어요 :) 노래 선곡도 너무 좋고ㅠㅠ 자주 가고싶은 카페에요!!$$베이커리 다양해서 넘 좋았어요 빵순이에게 천국같은 곳이였어용 ㅎㅎ! 그리고 밀크티 맛있었어요 ㅎㅎ$$알바교육 좀 시켜달라고 리뷰달라고 왔는데 저 뿐만이 아니였네요;;; 여자둘이서 속닥속닥 아주 그냥 손님이 들어오면 들어오는거고 나가면 그냥 자기네들 애기하기 바쁨ㅋㅋㅋㅋ 바쁘면 이해라도 하지 친절함까지 바라는것도 아니였는데 지금 알바로 있는 여자두분들 싸가지가 너무 없어서 다신 안갑니다. $$커피는 맛있는데 알바들 불친절함. 사장이 직원 교육에 손 놓았나 봄 ㅋㅋ $$정말 불친절 했습니다. 나만 그렇게 느꼈나해서 후기 보러 들어왔더니 사람 느끼는거 똑같군요!! 커피가 너무 맛있어서 이전 부터 자주 가던 커피숍인데 아르바이트생 한분이 가게 이미지 안좋게 하는데 주인 분이 알고 계셨음하네요. $$와우~ 직원분 굉장히 불친절 하시네요! 지나가다 커피한잔 사갈려고 들어갔는데 머리 묶은 여자직원분 교육 다시 하셔야겠어요.$$직원들의 무책임한 태도에 기분너무나빴네요 가지마세요 이왕이면 다른 카페 찾아가세요 여러분!  평점좋아 갔더니 너무별로고 장사잘된다고 생각하니 손님을 개무시하네요$$$$디저트가 종류별로 다양하게 있어서 마음에 들었어요 ㅎㅎ$$누네띠네 크로플 너무 딱딱하고, 브라우니는 자르면 가루가 부서지네요. 쑥크림라떼는 맛있었어요. $$카페 바로 앞에 문연거보고 좀 별로$$작년부터 거의 매일 사먹을 정도로 좋아했던 카페였는데 원두가 바뀌었는지 그 전의 맛이 아니네요 고소한맛이 사라지고 싼맛나요$$$$집에서 내려먹는 커피만 먹다가 바깥 싸제원두 먹으면 만족이 안됐는데 여기 원두 맛있더라구요 밸런스 굳  쿠키류도 맛있고요 $$$$앙버터스콘 맛있음. 커피가격도 싸고 맛있음.$$여기 크로플 존맛!! 쿠키도 존맛!!!!  커피도 싸고 맛있어요!!  근데 사람이 많고 너무 시끄러워요 ㅠㅠ 수다떨러 오시는 동네분들이 많네요 ㅎㅎ $$크로플이 맛있고 커피도 고소했어요~ 커피가 진한 편은 아니네요! 스콘은 빵 같았어요 약간 더 버터가 많이 들어가면 좋을 것 같아요ㅎㅎ 전반적으로 좋았어요!!$$커피가 정말맛있어요 $$강서구 일대에서 최고 커피 맛집 (크로플도 정말 최고임)$$여기 라떼 존맛탱ㅇㅋㅋㅋㅋㅋ얼그레이스콩최콩콩$$스콘 진짜 존맛탱이에요,, 스콘먹고 라떼 한모금이면 진짜 귓가에 상투스가 울려요,,, 꼭 드십시오,,, 스콘은 진짜 꼭 드세오,, 스콘 먹고 라떼 한모금이면 천국입니다,,증말루,,, 제발 스콘 안먹은 발산인 없게해주세요,,$$라떼만 마시는데 그동안 먹어본 프렌차이즈 라떼 중에서 최고에요 커피맛만 강한것도아니고 우유맛이 강한거도아닌게 부드럽고 진해요 라떼최고!! 아보카도 샌드위치ㅣ도추천!! $$여기 스콘 무지 맛나요^^~~~ 무화과 스콘과 티라미수는 JMT 예술이네요 더군다나 라떼까지 참 맛있어요   매일 가서 먹어도 맛있어요 아침이 브루클린 커피때문에 즐겁고 행복하네요$$커피 정말맛잇음 그 중 라떼는 진짜 최상의맛임 스콘도 직접하는건지 완전 맛있음 발산에서 카페는 여기만감$$커피 맛때문에 완전 단골인데 이제는 스콘맛집 인정ㅎㅎㅎ갈때마다 스콘도 꼭 사게되네용 !!  이동네에서 레트로감성 느끼기 딱좋음ㅎㅎ  로투스 스콘 무조건 드세여 강추강추$$커피랑 스콘은 맛잇어요! 근데 청포도 캐일주스 마시다가 비닐 쪼가리가 나왔어요 ㅠㅠ 그리고 직원 한분이 불친절해요; 두번 갔을때 똑같은 남자분이셨는데 질문하면 귀찮은듯이, 너무 불친절하게 답변하셔서 다시 가더라고 그 직원분한테는 주문하기 싫네요 $$좋아요~!
1771238411|소장식물전|$$이런…쑥라떼는 역대혁명임. 마실때마다 감동$$인테리어가 디저트가 어우러진.$$케이키 굿$$딸 덕분에 알게된 소중한 카페입니다. 분위기도 좋고 커피와 케잌맛도 좋아요~♡$$베이커리나 커피나 깔끔하니 만족스러워요 :) 파이는 꼭 드세요~^^$$$$단호박파이 너무 맛있어여!$$맛있고 분위기도 이뻐여$$식물 감성 가득~♥ 너무 예쁜 카페구 바나나케이크가 진짜 맛있었어요$$나의 작고 소중한 소장식물전..... 여기 사과케이크가 정말 맛있음 김치통들고가서 다 쓸어오고싶네 $$디저트 커피 모두 맛있어요^_^$$맛도좋고 분위기도 좋아요$$예쁜 소품들 구경하는 재미가 있는곳 맛은 특색이 있진않아요 ^^;;$$주차 공간이 없다고만 반복하시고 공영주차장이나 인근 주차장에 대한 정보도 알려주시지 않는 응대가 많이 아쉽네요  대로변에 주차한 차들 다 딱지가 떼어 있으니 차가지고 가지 마세요 멀리서 찾아왔는데 아쉬움만 가지고 돌아갑니다.$$트렌드에 최적화된 카페$$내부 인테리어가 맘에들었어요 조용한게 대화하기도 좋더라고요 ~$$사장님 친절하시고 분위기 좋아요. 커피맛은 보통 쿠키는 눈으로 보는게 예뻐요 ㅋㅋ $$$$진심으로.. 정말 별로 ㅋ$$커피는 별로$$매장이 굉장히 독특한데 너무 좁다. 케잌은 맛있었다.$$인테리어가 이쁘고 여기만의 분위기가 있어서 동네에서 가보기 좋은 것 같아요. 아 그리고 여기 우유를 두유로 바꿀 수 있고, 라떼에 꿀&연유 등 원하는 맛으로 넣을 수 있는 건 굉장히 좋더라구요.  쿠키는 생각보다 단단하고 달아서 제 스타일은 아니었어요ㅎ$$$$
837824252|고양이똥 3호점|$$커피 맛있어요  손님 가득$$티라미수 맛있고 음료도 다 괜찮아요 분위기도 감성 낭낭$$$$커피맛 굳$$버터스카치크림라떼 먹고 배가 좀 아팠는데 이것때문인지 확실치는 않지만.. 크리미하고 바닐라아이스크림 맛이 나는 고소한 라떼 였습니다.
27417322|브런치팩토리|$$30분 기다리라고 해서 주문하고 기다림. 빈 테이블들 여럿! 한참 뒤에 온 손님 식사가 먼저 나오길래 문의하니 오더 안들어갔댜며 죄송하다는 말로 끝. 기분좋게 브런치하러 왔었는데 기분만 엄청 상함. 죄송하다면 다인가? $$초심을 완벽히 잃은느낌  내가 감자튀김을 먹으러간건지 샌드위치를먹으러간건지 모르는 구성 재료도 너무 아낌$$no맛인데 가격은 싸다. 특히 파니니 치아바타류 무미! 사진에서 잘렸지만 좌상이 에지감자인데 몇번을 다시 튀긴건지 색이 갈색에 가깝다. 양심 불량  입구 들어서자마자 지저분하게 물건을 높이 쌓아놓고, 길쪽 창앞엔 커다란 재활용 쓰레기통 4개 나란히. 어이상실$$아침부터 브런치 땡겨서 이곳저곳 찾아보다가, 여기 오픈하자마자 볶음밥, 파니니, 샌드위치 주문했는데 맛있어요!! 짱짱구리!$$매장이 깔끔하지 않고 좀 더러운 너낌.. 그리고 그저 그런 맛... 아주 맛있는 브런치 식사를 기대하고 가면 안 되는 곳 같아요$$괜차나용$$가격이싸고 가격에 어울리는맛. 실내가 비좁음$$걍 스낵집 수준임. 반드시 실망합니다~$$먹기전에 대기때문에 10분걸린다고 해두고 정작 30분 넘게 사람 밖에서 기다리게 하면 어떡합니까.. 결국 테이크아웃했는데 다음부터는 장사하기전 시간체크해서 좀 관리좀  부탁드릴게요.$$주차하려고 들어가니 아파트 단지 관리인 분들이 주차 관리하는거같았는데 경비하시는분이 너무 비꼬고 무례하시네요... 주차하다가 기분나빠서 그냥 나왔습니다$$진짜 맛있음$$맛도 양도 충분히 경쟁력있네요 맛있게 잘 먹었습니다. 가격도 굳~~~$$가성비 좋구 양도 푸짐하고 좋았어요~  근데 인기가 넘 많아서그런지 대기가...ㄷㄷ 주문 받고나서 30~40분 기다려야한다고 말하더라고요 ㅡㅡ 받기전에 얘기해주시지...ㅠ$$위치찾기가 힘들었는데, 양이 많고 맛있어요!!$$맛있고 친절하고 최고입니다~$$$$가격대비 좋은거같아요~~$$최애!!!!!!!!!!!$$맛있고 저렴하고 친절하십니다 두 번 방문했는데 두 번 다 기분 좋게 먹고왔어요 또갈거에용  $$어쩌다 먹을만해요 ㅋㅋ$$$$별로..ㅠㅠ$$기름냄새가 쩜... 맛도 그닥...$$
