URL_ID|카페명|리뷰
1540882128|성북동빵공장|$$성북동 사람으로서 왜 잘되는지 이해안되는 집 중 하나. 쪼꼼만 내려오셔서 샤뽀블랑이나 밀곶간와서 빵사가세요!! 진짜 너무 안타까움$$빵은 퍼석거리고 크림이 느끼합니다. 빵만 많고 크림은 적어요 ㅎㅎ 맛없.,근데 8000원. 가성비 매우별로.$$어제지나가다가 배고파서 다녀왔는데,  결론은 한번이면 충분하고 굳이 가시지 않을것을 권합니다. 가성비는 5%수준입니다.$$대체 왜 오는거냐  여기도 성북동 버프받고 사람들이 찾아와주니 배짱장사중 옆에 있는 갈비탕? 식당도 더럽게 맛없는데 매번 주차장 풀 되있는거보고 기절할 노릇이다$$손님이 너무 많아서 알바분도 발렛하시는 분도 화가 많으신 듯 하네요.$$앙버터 최악입니다 바케트가 겉과 속이 다 눅눅하니 똑같아요 거의 팥맛만 니고 오지게 비싸기만하고ㅠㅜ 생일날 친구들에게  기분좋게 한우얻어먹고 가볍게 커피3잔과 빵몇개 샀는데 54200원..실화? 동네라 기분좋게 멀리서 온 친구들 대접했지만 속은 쓰렸네요..계단 뷰가 그나마 특이해서 별점2개로 추가 올립니다$$맛있는데 별점이 낮네요 ㅜㅜ    왜지..  비싸긴 한데 그 만큼의 가치가 있어요$$빵2개 음료2잔에 27,900원나옴ㅋ ,,,,,,,,왓??????,,,,,뭐 심지어 맛은 동네 빵집만도 못해서 더 속상하드라구요,,,ㅋ3만원이나 썼는데 맛도없어서 기분나쁘게 배부름,, 글구 자두에이드 8천원주고 시켰는데,  생자두가 아니라 자두시럽이고 이마저도밍밍하게 태워주대요,,,,,,8천원내고 자두향 첨가 탄산수마시는꼴이였지요~~~ㅠㅠ 요기 발렛악명 높...$$생크림팡도르만 사러가요.  다른건 너무 비싸고 가격만큼은 아니어서...  생크림 팡도르는 정말 맛있어요. 한번 먹고 자꾸 사러가게 되네요$$발렛 ㅋㅋㅋㅋ1분만 대도 2천원은 뭐며 발렛은 그럼 나갈 때도 차 가져다 줘야하는거아님? 저 아래 세워두고 직접가라하네 빵음료 싼편도 아닌데 음료빵 다사먹고 물좀달라하니 사드셔야한다네 근데 에비앙 2500원짜리 개작은거밖에 안판다 ㅋㅋㅋ 진짜 돈많이 벌으세요 어이가 없어서 다신 안감$$진짜 비싸고 맛은 그냥그렇고.. 커피는 진짜 맛없음.. 둘이가서 5만원 썻는데도 물달라니까 사먹으라고함..$$사장이 댓글들을 전혀 읽지 않습니다. ㅋ$$1점도 아까운^^ 카페로 들어가려는데 나이 많고 안경 쓴 발렛직원이 바로 옆에서 손님 욕을 하네요 "♪♪♬♪새_끼가 며칠전에 왔을 땐 주차비 어쩌구저쩌구~" 잘못 들은 줄 알고 멈칫해서 쳐다봤는데 동료 직원한테 끝까지 욕하는 직원 .. 간단히 질문 하고 주차비 결제하자마자 등돌려 욕하는 태도가 참.. 도착해서 제일 먼저 만나는 직원이 그런 사람이고 왜 그런...$$6.13일 오후 9시경 방문했는데 뚱뚱한 안경쓴 남자 직원 너무 불친절하네요. 항상 친절한 곳이라 좋았는데 아닐때도 있나보군요$$카페 직원이 진짜 ㅋㅋㅋㅋ 다른분들은 친절한데 안경쓰신 여성분 무슨 이상한 눈으로 쳐다보고 귀찮은 티 팍팍내고 대답은 안하고 고개만 기울어서 끄덕끄덕하네요 지금껏 음식점 다니면서 그런 직원은 처음봤습니다 직원 다시 뽑으셔야할것같습니다 서비스업이라는걸 잊지 않아주셨으면..$$주변에 살고. 몇번 손님와서 가긴 하지만.  다른사람들은 왜 여기에 올까? 하는 생각만 남. 볼거없고. 불친철하고. 발렛은 거의 불친절을 떠나 험하다고 할까.... 길 지나가는차 멋대로 막고서 손님차 나가라고 함. 차주가 미안할정도.  $$$$유명한만큼 뭐가 맛있는지 잘모르겠음  주차발렛하기 너무힘듬.... 사람도 무지많음    그래도 먼가 산속의 빵집이라 느낌은 좋습니다$$빵맛은 괜찮았는데 ㅋㅋ$$발렛요원이 너무너무너무너무너무너무너무너무너무너무너무너무너무너무너무 친절하세요 ㅋㅋㅋㅋㅋ  부담스러워서 다신 안가려구요  ㅋㅋㅋㅋㅋㅋㅋ$$설마하고 후기글 보러 들어와 봤더니 나만 그리 느낀게 아니었군요. 발렛직원들의 태도에 정말 밥맛떨어짐. 무슨 조폭도 아니고 차마 말을 섞기조차도 싫었음. 그런데도 손님이 있는거 보면 신기함. 다시는 가고싶지 않다. 평생 처음 음식점 댓글을 써본다.$$1) 계단이 너무 많아서 불편함 2) 직원들 별로 일할 마음이.없는듯 3) 발렛하는 사람들은 수준 이하임     손님한테 큰소리치고 명령하듯 함부로 대함     발렛 하는 사람들 언어수준도 많이 부족함  같이간 일행들 모두 기분이 상함..  주변에 친절하고 더 분위기 좋은 곳이 많습니다.  별 1개도 너무 아까운데 이 글을 위해 어쩔수 없이 별 하나줌.. ...$$$$와 여기 뭐지..?  발렛이 너무너무너무너무 불친절함 아니 불친절이라는 말조차도 아까움  거의 싸우자는 느낌..   아기 카시트에서 내리느라 시간 좀 걸리는데도  계속 차 문 두드리면서  왜 안내리냐 답답하다는 듯  빨리 내리라고 함   1점도 아까움. $$$$계단 너무 많아 불편하고 이름대로 카페가 아니라 공장 느낌이에요... $$맛있었어요 날씨 좋으면 밖에서 햇빛쬐며 먹는거 추천$$마음에 드는거 하나도 없어요. 빵은 다 딱딱하고 이빨 다 나가는줄..!!!!!! 크로와상도 딱딱하면 어쩌자는거죠. 말다했음. 비싸긴 또 왜케 비싼거죠 유명하다고 해서 왔는데 헛소문인듯..ㅡㅡ오지마세요.$$빵 맛있는데 이정도 빵은 다른데서도 맛볼수 있음 건물 구조가 특이해서 오르내리기 불편 ㅜ 뷰도 그닥..?$$발렛 주차요원이 정말 문제많음. 포장예약하고 픽업 잠시 갔다왔는데 차를 빙빙돌리고 주차딱지 끊겠다고 위협을 하질 않나. 얘네들 도대체 교육도 제대로 안하고 머하는지.. 경찰에 신고하려다가 참음. 다신 안갑니다!$$생크림 팡도르 먹어봤는데 맛있었어요 또 가보고싶어요 못먹어본 빵이 많아서$$다 먹어본건 아니지만, 먹어본 빵은 다 훌륭했습니다~  저렴하진 않지만, 다 이유가 있는듯한 맛이에요.  코로나 이후로는 배달시켜 먹네요 :)$$맛은 있는데 주차부터 개친절$$$$$$커피 비싸기만하고 별로$$아웅~~~빵도 커피도 너어무 비싸요;;; 왠일이래~~~;;; 발렛비도 2천원~~;;;$$빵만 비싸구 불친절 ㅜㅜ 별루에요$$$$$$많이 비쌈. 야경은 그냥 볼 것 없음. 그냥 폼내고 싶을 때.. 돈 쓰고 싶을 때.. 가는 곳.$$발렛 하는 사람들 싸갈스가 바갈스. 손님한테 짜증내고 소리지름.  빵도 별로. 밀가루가 이상한건지 빵마다 특이한 냄새도 나네요. $$볼것도 없고 빵은 비싸기만 하고 주차할곳도 없는데 주차비만 뜯어감.$$성북동 면옥집. 옆에 성북동 면옥집 식당도 있습니다. 커피맛도 좋고, 건물 외벽에 그려진 예쁜 벽화그림과 자연속 풍경이 보이는 테라스가 너무 좋았습니다~ 그리고 주차장이 협소하다보니, 발렛직원분이 매장에서 떨어진 더 넓은 주차장으로 주차를 해주시고, 고객이 식사가 끝나면 다시 가져다 주시는 방식입니다.^^$$$$빵은 그렇고 그런데... 발레  서비스 하는 사람들은 문제가 많네요 분위기 찾아 갔다가 기분 잡쳐서 나오게 만드는 훌륭한 재주를 가진 듯 합니다. 다시는 가고 싶지 않네요. $$가지 마세요 평보고 에이 설마하고 가봤는데 발렛요원 진짜 싸가지가 없어요ㅋㅋㅋㅋ 빵사고 나와서 주차된 차 쪽으로 갔더니 아 왜 나오시냐고 들어가서 차 번호 얘기하라고 소리질러서 아침부터 왜 소리지르시냐 그랬더니 그쪽이 아침부터 기분 잡치게 했다고 하네요ㅋㅋㅋ 교육이 필요없는 사람인듯 그냥 자르세요 사장님 손님들 다 없어지겠네요  검은 선글라스 쓴 남자분$$발렛 주차요원 인지 너무 불친절 주차요원 일 힘든건 알지만 일하기 싫으면 관두세요 ㅋㅋ$$발렛이 너무 불친절해요$$팡도르 촉촉하니 맛나서 자꾸 생각나요.  $$발레 파킹 하는 사람들 매우 무례하고 불친절하네요. 이 곳을 방문해서 처음으로 대하는 사람이 이런 사람들이라면 다시는 오지 말아야겠다는 생각뿐. 장사 좀 된다고 하니까 손님을 손놈으로 취급하는가 봅니다.  ㅉㅉㅉ$$$$빵이 예뻐요 커피는 약간 약한 느낌 햇볕이 잘 들어 좋아요$$$$발레하는 분(피부 좀 검고 동그란 안경 쓰신 분)이 매우매우 불친절하네요.  솔직히 이제 안 올 것 같습니다.  그동안 좋은 추억을 가지고 있었고 그 추억으로 방문하는데 그 추억을 망치고 싶지 않네요.  안녕히 계세요.$$훌륭했던 팡도르가 날이 갈수록 형편없어지네요. 어제는 진짜 먹디 뱉고 싶은 수준이어서 남기고 왔습니다. 팡도르 핑계삼아 동네 산책하던 재미도 이젠 접어야겠습니다. 어느 곳이든 뜨내기 손님 많아지면 형편없어지는 건 진리인가 봅니다.$$바빠보이지만 직원들이 친절하려고 노력하는게 보이네요^^$$빵 값은 비싸고  종류도 적지만  전망이 좋고 자리도 널찍해요.  바로 앞에 있는 오십년은 되어 보이는 오래된 서울아파트 집값이 궁금해져요.$$수준 높은 빵과 함께 마시는 아메리카노커피 아주 촣습니다. 자주는 못가도 간혹 생각나는 그런 곳. $$일부러 찾아갈 이유는 1도 없다$$라떼 6500원내고 창가운 커피 마시고왔네요. 오븐에 빵데우다가 손데일뻔! 돈좀 버셔을텐데 어찌 그리 허접한오븐으로 손님한테 직접구으라 하는지 이해불가했고요. 직원들 불친절하고 다시갈이유 전혀없어요$$하아. 불친절의 끝.이정도면 알바새끼들끼리 작정하고 불친절하게 하기로 합의보고 하는듯. 오늘 노란머리 여자스텝 진짜 욕한바가지 하고 싶었다.기본 인성을 갖추길$$너무 불친절하고 별로에요. 빵 싸는 속봉지도 구매해야한대서 어이가 없었어요. 직원들 교육좀 잘 시켜얄듯요 $$식당은 평범, 빵은 괜찮은편 주차비 별도, 고장난 카드 단말기를 가진 주차장  멀리서 찾아갈 필요는 없는곳$$$$너무 불친절함. 최악.$$$$요새 트렌드인 빵공장+대형커피숍의 전형. 특별히 흠잡을건 없으나 주차공간은 턱없이 부족해서 바쁠텐 금방 혼잡스러워짐. 가급적이면 일찍 이용할 것.$$빵 자체는 밀가루가 구린건지 맛이 없고 빵에 들어가있는 버터나 크림은 너무 달고 직원들은 불친절하고... 굳이 동네주민 아니면 갈 필요 없을듯.$$맛난 커피! 빵도 맛있어요!$$동네사니까 산책겸 갈만한 곳! 차타고 와서 먹기에는 발렛대기도 복잡하고 앉을만한 곳도 마땅찮고 시끄러움! 무엇보다 빵은 일찍 sold out!$$맛은 있지만 이 가격대의 맛은 아니다. 포장해가는 사람에게는 더더욱$$최고~~$$녹차롤케익 혹은 도지마롤 맛나요. 강추. 완전 살살 녹아요. 빵도르 괜찮았고 나머지 호두빵 등은 그냥 그랬어요. $$앙버터는 그냥 그래요...네... 그리고 직원분들이 아침이라 그런신지 ... 넘 불친절해서 놀랐습니다$$빵과 커피가 맛있는지는 모르겠지만  (빵은 안좋아하고, 커피 맛은 별로) 서울 안에서 그나마 한산한 주말을 보낼 수 있었고, 주차가 편리하다. $$높은 천장과 전망좋은 인테리어. 빵은 맛의 편차가 좀 있긴하지만 와볼만한 곳이에요.  빵 가격은 좀 비싼편이에요.$$알바는 열몇명씩 있는데도 테이크아웃 빵 두개 받는데 십분 이십분씩 걸리는게 이해가 안된다. 이런적이 한두번이 아니여서 남긴다.  매장에 앉을수 있는곳이 삼층이나 되고 발렛파킹이 있는데 계산대가 두개밖에 없는게 말이 안됨!!! 줄 십분 기다리고 빵 받는데 십분 기다리고... 너무한다...  빵은 맛있음.... 하지만 시스템은 좀 바뀌어야합니다!!!!!!!!!...$$주차요원들이 안하무인으로 행동합니다. 저뿐만 아니라 이모도 주차요원한테 기분 나쁜일을 당했다고 하네요. 특히 약수터 가는 좁은 길에 발렛파킹장이 있는데 도로가 한개라 마주치면 후진해서 비켜줘야합니다. 오히려 제가 더 많이 진입한 상황에서 주차요원이 탄 차량과 마주쳤는데 전혀 후진할 생각이 없길래 제가 40미터 가량을 계속 후진했습니다. 그랬더니 차를 박을듯...$$장소, 인테리어, 주변 경관은 괜찮은데, 빵가격은 좀 비싸다. 왜 유명한지 잘 모르겠다는.. 주변에 경쟁업체가 있다면 그쪽을 선택할 가능성이 높다. $$정말 비싼데 맛은 별로에요.. 빵도 커피도.. 사람도 정말 많아서 자리 없고 서비스 안 좋고 지저분해요.  애들이랑 밥집 기다리느라 갔는데..  커피마저 맛이 없었어요. $$비싸고 특별히 맛있지는 않음.. 팡도르 크림은 너무 아꼈더라..6000원 넘었던것 같은데.. 인테리어는 괜춘..근데 일부러 찾아갈 가치는 없음..$$그렇게까지 맛있는 빵집은 아닌것 같아요 $$$$가야는 이유 : 면옥집에서 식사하고 가장 빨리 이동할 수 있는 베이커리카페, 오래된 빵집 느낌 안가는 이유 : 아메리카노보다 라떼가 2천원 비싼건 처음봄$$A Loaf of Bread$$커피향이 정말 정말 죽인다. 빵도 좋을 것 같음. 늦어서 빵 냄비가 텅 빔. $$맛,가격 : 빵맛이 있다 근데 생크림 팡도르같은 베스트 메뉴라고 써있는 빵들 너무 달다. 그리고 가격이 비싼편이다.   분위기: 가게 안에는 소극장처럼 좌석을 꾸며놓았고 2층에도 자리가 있고 천장이높음. 인테리어는 꽤 괜찮은편이다. 오픈한지 얼마안되었지만 사람들이 벌써 많다.   접근성: 접근성이 좋지 않다. 버스타고 성북동 위까지 올라와서 언덕을 걸어 올...
7940056|수연산방|$$최악….정말 가지마세요^^ ㅎㅎ 정말  리뷰로 남기고 싶을정도로 불친절과 신발….조심하세요^^ 처음부터 불친절로 응대로 시작으로 끝까지 불친절 ^^ 정말  좋은 건물이지만 다시는 가고 싶지 않은곳입니다 $$$$가격대는 있었지만, 시골 외할머니댁에 다녀온 아늑하고 따땃한 곳이었어요 :) 겨울 눈올때 가면 또 예쁠것 같습니다$$최악..너무비싸고 맛없음..웨이팅 길고 불친절$$좋음~ 너무 유명해져서 사람 많은건 ㅂㄹ$$나쁘지 않습니다$$비싼거 빼고 다 좋아요~ 풍경도 맛도 분위기도$$가볍게 공간을 음미.$$$$$$맛도 좋고 전체적인 인테리어 스타일도 좋아요. 한옥, 근현대적 건물, 마당이 잘 어울려졌네요. 코로나 때문에 건물 안이 아니라 밖에 마당에서 먹었는데 운치 있고 좋았어요.  다만 가격이 좀 비싸네요. 운치 있는 자리의 자리세라고 생각하고 먹었어요. $$$$유야호$$1월 말 기준 영업 안 하고 있었어요 가시기 전에 전화 한 번 해보세요$$한번쯤은 가볼만한$$이 가격에???$$$$$$장소가 이쁜것 빼곤 다 별로.. 비싸고 맛도 그렇게 있진 않음..$$맛 좋고 분위기 좋고 주변 환경 좋지만... 너무 비싼게 흠.$$신맛 대추차를 드실거면 추천!!  보기좋은 팥빙수, 건강한 맛을 원하시면 추천!  오로지 인스타 사진을 위해서 가시려면 추천!  $$분위기 너무 좋아요~ 음식도 맛도 있지만 가격이 너무 쎈것같아서 아쉬워요....ㅜㅜ$$이가격 내고 먹을 곳은 아님 $$오미자차: 새콤하기만 함 단맛× 단호박 빙수: 눈꽃빙수×..... 이럴줄 알았으면 안시켰음 구기자국화차: 단맛 조금 남 유일하게 좋았음  카페 내부 운치가 장난이 아닌데 가격도 장난이 아니고 맛도 장난이 아님 사진 몇장 찍자고 오기엔 너무 비쌈  남들이 말리는데는 이유가 있었어..$$고풍스럽고 아늑한 분위기는 좋으나..주차 넘 어려운..차맛이나 고객응대는 매우 만족^^$$너무 너무 불친절해요   인테리어 익스테리어 다 평범하지만 나온 음식은 다 맛있었어요$$겁나 비싼데 뭐 매일가는건 아니니까 날씨조을때 가세여$$$$분위기 건강한 맛 가격은 덜덜$$$$가격이 사악하지만 분위기 있어요. 호박빙수 맛나요$$한옥이 예뻐서 가게돼요$$10년 전에 와보고 길상사 가는 길에 들러봤습니다 그때보다 더 별로네요... 오랜만에 다시와봐도 역시 자주올 집은 아닙니다 집은 거의 그대로인데 추억과는 달리 매우 번잡해짐. 인테리어소품도 거슬리고 가격바가지는 여전하고. 문화재급 관광명소인 집 자체의 운치에 이끌려 많이 와주는 관광객, TV마케팅에 낚여 찾아온 호갱님들 덕분에 망하지 않고 더 요란해졌습니다...$$분위기 이쁘지만 너무 차 값이 비싸고 맛은 좀 쓰고.. 교통 매우불편$$분위기만 좋고 차나 팥빙수 등의 맛은...ㅎㅎ 기대안하고가는게 좋아요. 그리고 살짝 불친절.. 그래두 한옥이 워낙 예뻐요.$$팥빙수의 기본은 빙수의 질 빙질이 진짜 별로입니다. 단호박 아이스크림도 별로. $$분위기는 좋지만, 간만에가니 가격이 너무 오른 것 같음. $$고즈넉하니 좋아요 ^^ $$고즈넉한 분위기가 너무 좋아요. 가격대가 높긴 한데 그래도 여러번 방문할만한 곳이에요. 부모님 모시고 오고싶어요.$$4인 테이블 뻔히 비어있는데 두명 왔다고 자리 안주고 30분 동안 밖에 세워놓는 이상한 가게....덕분에 감기만 걸렸네요. 공짜로 줘도 안갑니다. $$$$$$나오는 차와 다과는 맛있었으나 1인 1잔 주문 기본에 웨이팅이 길고 고즈넉한 분위기 보다는 상업적인 느낌이 나네요.$$$$단호박빙수의 원조인 전통카페로 분위기가 운치있고 고즈넉해서 마음이 편해진다. 대추차와 인절미도 정갈하고 맛있지만 가격은 너무 비싸다.$$맘에 든건 하나없고 비싸기만한 이곳 다시는 가고싶지않은곳$$$$비싼거 빼곤 분위기 맛 나무랄데 없는곳$$클래식을 전통악기들로 연주한 곡들이 나오는 것도 좋고 고즈넉한 분위기도 좋고 한옥도 좋고! 맛은 건강한맛 ㅎㅎㅎㅎ 가기가 좀 불편한게 아쉬운...$$$$아담하고 고즈넉한 고택과 마당. 다만 음료값이 좀 비싸다. 좋아하는 동네에 있어 어울림$$$$$$$$$$$$상허 이태준 先生 생가 지금은 고즈넉한 전통찻집$$$$$$메뉴 비싸고.  조그만 중인주택. 분위기 사적임. $$그 가격을 받기엔 분위기도 그닥$$$$단호박빙수 2인 19500원 베리막걸리빙수를 먹고싶었는데 떨어짐 ㅜㅜ 빙수맛은 그냥 올드피플들이 좋아할거같은 맛이었음ㅋㅋㅋ 서울속 시골느낌 분위기 좋음$$
