URL_ID|카페명|리뷰
702337989|라라브레드 송파점|$$진짜 너무 맛있네요!! 더테러치즈 진짜 춱춱하고 치즈 덕후들 달려가세요!! 그리고 투움바 파니니도 소스가 최고입니다.. 강추해요$$송파의 성심당, 송파의 뚜쥬르! 좋은 재료에서 비롯된 풍부한 맛과 합리적인 가격대가 인상적이다. 오래오래 자리 지켜 주시길.$$석촌호수 근처에 항상 줄 서있는 브런치카페를 봐왔는데 드디어 가봤네요ㅋㅋㅋㅋ 기대 이상으로 맛있었어요$$빵 종류도 다양하고 다 맛있는 메뉴뿐이라 맨날 통장돼요ㅠ 브런치 중에 아보카도랑 새우 들어간 거 먹었는데 지금까지 먹은 브런치 중에 손에 꼽을 정도로 맛있었어요! 재방문할거에요ㅠㅠ$$빵이랑 음료랑 뭐 하나 맛있는 게 없어요...분위기도 시장바닥같아요 파운드케잌 스펀지같아요$$브런치도 맛있고 빵도 맛있었어요! 내부도 예뻐서 브런치 먹고 빵 포장해가면 딱이에요$$다 좋은데 화장실 음악 소리가 너무 커서 귀가 아파요$$새우의 역습? 그거 진짜 맛있어서 2년 전에 먹고도 생각나서 또 다녀왔어요 .. 이번엔 투움바 파니니랑 치아바타에 완전 반하고 갑니다 ㅜㅜ$$빵은 맛있어요. 다만 평일 2층엔 사람 없다고 아주머니 무리들이 무례할 정도로 시끄럽게 떠들어서 금방 나왔네요.. 직원분들께서 다른 층도 자주 오가며 관리해주시면 더 좋을 것 같아요:)$$잠실에 라라브레드 처음 생겼을때부터 갔는데 갈수록 빵도 더 많아지고 브런치도 맛있어지네요ㅎㅎ$$브런치 맛있게 먹었어용!$$식빵은 무조건 여기서 먹어요 쫄깃쫄깃 ㅠㅠ$$빵이랑 브런치가 맛있어서 자주 찾는 곳, 시즌마다 신메뉴도 나와서 자주 가게되는 것 같아요$$갈때마다 사람이 많아서 포장을 주로 이용해요 올리브치아바타랑 쫄깃식빵 진짜맛있어요!$$리뷰 알바들인가요? 동네 아무데나 가서도 먹을 수 있는 그런 빵들뿐인데 도대체 뭐가 특별한건지 리뷰들 정말 ㅠ 속았네$$크로와상이랑 브라운치즈브레드 진짜 맛있어요$$넘 예쁘고 맛있어요 크리스마스 케이크로 강추해요!$$넘나 예쁘고 맛있는 케이크였어요$$엄청 부드러운 딸기 생크림 케이크에요! 잇몸으로 먹을 수 있을 정도로 사르르 호로록~ 딸기도 많이 들어있고 시트도 퍽퍽하지 않아요! 다 먹고 나면 입술이 슈렉처럼 초록초록해지지만,, 맛있어요ㅎㅎ$$갈때마다 맛난빵들이 한가득이라 한두개 사고나오기 너무 아쉬운 라라브레드ㅠㅠ 늦게가면 빵들이 거의 다 팔려가지고 일찍가는게 좋을것 같아요! 매번 빵 포장만 해가다가 최근에 브런치 먹었는데 요기 브런치 맛집이네여!! 파스타랑 파니니랑 둘다 강추입니다! 거기다 이번 크리스마스 케이크 진짜 너무 이뻐요 안에 딸기가 가득가득해서 덕분에 연말파티 잘 즐겼습니당$$사전 예약으로 케이크 수령해서 즐거운 홈파티 보냈습니다! 친절하게 응대 해주셔서 좋았습니다 ㅎㅎ$$사진에 있는 메뉴 진짜 존맛탱 ㅠㅠ 친구가 미리 시켜놔서 메뉴이름은 모르는데 진짜 맛있어요 간단하게 진짜 짱임 ㅠㅠ 다들 드셔보시길 소스가 도라방스.. 또 먹고싶네요.$$처음 가보기전에는 비쌀줄 알았는데 비싼편은 아님(물론 가격이야 높지만 우리나라 자체 빵값이 비싸니)  그리고 앵간한 빵집 보다 맛있음 맛있는빵집 일반빵집 사이 중간쯤은 되는 맛$$먹을때마다 왜 인기있는지 모르겠어요 그냥 무난해요$$쿠키 세 가지 맛 먹어봤는데 얼렌지쿠키가 너무.. 맛있어요.. 다른 종류들도 더 먹어보고싶음ㅜ$$지나갈때마다 사람이 많은거같아서 기대했는데 생각보다 별로에요. 인기메뉴가 다 떨어졌었고 제가 고른 빵들은 그저 그랬습니다. $$딸기요거트 스무디가 진짜 맛잇어요 바닐라 라떼도 생각이상! 더블초코브라우니 맛잇어요  대신 지하층과 2층 다 너무 시끄러워요 ㅠㅠ 핑크색 방은 소리가 울려서 엄청나요;;$$$$맛있어요!$$가성비 굿굿$$라라브레드 브런치 꿀맛탱입다! 포장도 잘되니 드라이브갈때 포장해서 뙇! 먹으면 너무 맛나용$$$$빵 맛집은 아닌듯..$$송파에서 대존맛손꼽는 마카롱집♥️$$$$$$말해 무엇? 쫄깃식빵 느무 좋아$$빵맛있고 날좋은날 테라스 넘 좋아요!$$요즘 빵이 자주 타고 맛이 없어졌어요ㅠㅠ 지난 2년간 자주 갔던 빵집의 맛이 변해서 속상하네요$$$$라라브레드 빵 좋아해서 배달시키거나 직접가서 사먹는 사람이었어요. 저번에 매장방문해서 빵고르는 중에 직원들끼리 큰 목소리로 심한 욕을 하면서 사적인 얘기를 하는데 정말 불쾌했습니다. 저 말고 다른 손님분도 계셨어요. 그 때 이후로 안사먹습니다. 뭐 직원 한명이 그런것도 아니고 계산대 뒤에 여러명이서 그러는데 정말… 기본이 안되어있어 보였습니다. 맛있는 빵집...$$맛있어요  손님이 많아서 조금 오래걸리긴함 ㅋ$$$$연유프레첼?안에 버터들이 다 녹아서 흐물흐물 빵만드시는분 옆에 지나가는데 담배냄새가....괜히 찝찝 위생적으로 괜찮을런지$$$$맛있다!$$음................$$라라브레드는 식빵이 진짜 최고.. 먹어본 식빵 중에 제일 맛있음$$서민갑부 나왔데요 내입맛은 그냥그래요$$$$불친절해서 정말 깜짝놀란곳,,포인트적립안내 말로만 대충하고 화면 뜨기도전에 뒤돌아서 일보러감..$$ㅋㅋㅋ.. 일하기 싫으면 하지마세요. 평일 오전 캐셔분... 썩은 표정에 소리지듯이 응대...$$커피 주문 받는 분 너무 불친절해서 .. 다시는 방문할 일 없을 듯 합니다$$$$$$생각보다 평범.$$서비스 완전 최악이다!   다시 안 감 ㅠㅠ  직원들은 나무 친절하지않아요 $$$$진짜 어처구니가 없네 테이블 자리도 없는데 주문 받는건 뭐냐 제발좀 먹고 갈거냐 물어보고 자리 여유좀 말해줘요 $$빵,커피,위생상태 다 기본이상  빵 다 맛있어서 사왔어요 $$생각보다 평범.$$서비스 완전 최악이다!   다시 안 감 ㅠㅠ  직원들은 나무 친절하지않아요 $$$$빵한개에 4000원 ... 간에 기별도 안가요..$$맛은 평타..  서비스는개판  손님은많은데  자리는없고..  음식은 나왔는데 자리는없는데 계속 손님받으면 어떡하냐고 얘기했더니  한다는소리가  어떡할까요 테이크아웃 해드려요?  이소리  한마디하고 땡    그뒤로도 계속  결재는받는데 손님은쌓이고  코로나판국에 사람들 일렬로음식쟁반들고 계단에서서 지하가갔다 2층갔다  20분은 서서기다린듯   절대비추입니다 ...$$빵도 맛있고 좋아요! 다음에는 브런치 먹으러 또 올거에요~$$빵은 맛있어 보이나 사람이 너무 바글바글....  지하도 2층도... 바글바글......... 시끄러운 거 안 좋아하시는 분들은 오래 못 계실 거예요 빵만 사 오고 나오세욤$$$$마싯어요$$$$계산하는 여직원 왜케 불친절하죠 말투 왜그러시는지??? 불쾌해요 진짜 $$여기 땜에 살 많이 쪘어요 ㅠㅠ$$아니 이런빵집이 맛집이라녀? 맛있는 빵집이 알마나 많은데... 말도안돼.. 파바나 토우스레스쟈우르스도 여기보단 나아요. 곰팽이느낌의 스콘먹거 설사만지리고있어요. 아힝 다신안갈래
1877651691|벨라스가든|$$두번째 방문! 너무 맛있어요~무엇보다 친절하신 사장님과 직원들~최고입니다^^$$음식 나오는것도 이쁘고 매장도 이쁘지만  음식이 그렇게 맛있지 않음 ㅠㅋㅋㅋ$$음식예쁘고 응대도 좋습니다만.. 음식은 보통이에용! 특별히 맛있진않지만 분위기좋아요!$$$$친절하시고, 모든 세팅이 훌륭합니다. 하지만 정작 음식이 별로 맛이 없어요. $$굿굿!! 언제나 내부도 이쁘고 음식도 이쁘구!$$꽃게 로제파스타 맛있음. 꼬꼬뱅도 맛있는데 좀 더 뜨거웠으면 한다$$$$$$친구들이랑 가기 좋아요$$어두워지면 불끄고 촛불 켜줘서 분위기가 업돼요. 소개팅에 가면 좀 시끄러워서 비추고 지인들 만날때 가면 좋아요. 양이 적어서 3명이서 4개 시켰는데 배부르게 잘 먹었습니다$$맛있었어요. 가격 비싸고 양 적다는 얘기가 있었지만, 충분한 양이었고 맛이 좋아 만족스러웠어요.$$분위기가 좋았어요$$다 맛있네요 ㅎ 분위기 여자여자함$$$$$$부드럽고 좋습니다$$맛있어요 가게가 깨끗해서 업무 관련 아는분이랑 만나기도 괜찮아요 주말에는 사람 많아서 예약하시는게 좋아요 특히 창가나.. 좋은 자리 앉으시려면! 여기서 식사하고 옆에 서정적살롱 가서 커피 마시는게 코스로 괜찮습니다 (서정적살롱 음식은 그냥 그래서..)$$맛있는데 음식이 늦게나와서 오래 기다렸어요1$$분위기가 좋고 맛도있어서 좋았어용$$뷰는 없지만 맛과 분위기는 좋아요 추천^^$$맛 분위기 가격 다 만족스러웠어요$$소개팅 성공코스로 강추합니다! 로제파스타와 오픈샌드위치 맛있어요 ㅎㅎㅎ$$별 세개는 아니고 세개반  친절하고 분위기 좋음  파스타 종류는 다 괜찮은데  샐러드는 좀 아쉬움 ~$$로제파스타 넘 맛있어요! 분위기도 좋고 데이트하기 딱 좋은 거 같아요:)$$꽃게파스타 5/5  안심 고르곤졸라 파스타 3/5  감바스 2/5  버섯 샐러드 4/5  더치베이비 3/5   채광이 좋아서 생각보다 매장이 별로 안 시원했고, 물도 좀 미지근...? 더운데 물이 안 시원해서 당황스러웠네요. 직원들은 친절해서 좋았어요.  $$오픈샌드위치 1점 / 꽃게파스타 5점 $$크리스마스에 갔는데  셋트 괜찮았어요  근데 굳이 이가격주고 먹어야하나 싶었음 $$5만9처넌짜리 세트메뉴는 절대 먹지마라...$$지난 2년간 8번 방문했는데 매번 만족한다. 송리단길에 변함없이 서비스 좋고 맛좋은 곳이 많지 않은데 벨라스가든은 훌륭한 식사를 통해 좋은 시간을 보낼 수 있는 공간이다. 인테리어와 조명으로 인물 사진도 잘나오고 샹그리아와 샴페인과 같은 드링크류도 추천 할만하다. 꽃게로제파스타를 강추하며 샐러드는 보통 리조또는 아쉬운 감이있다. 팬케이크도 강추!! 익힌정도...$$송리단길 브런치,벨라스가든 아름답고 친절하신 미모의 여사장님  눈과 입이 즐거운 식사 만족스럽습니다$$꽃게 로제 파스타 졸맛탱 인생파스타$$너무 맛없어서 실망 ,, $$오픈샌드위치는 정말 가격값 못합니다.  그렇다고 인테리어빨이라 하기에도 타 레스토랑에 비해 미미하구요.  호밀빵 3쪽에 약간의 햄과 새우 토마토 등 넣고  치즈 뿌린게 끝...소스랑 재료 조합도 따로 놀아요.  먹물 리조또는 맛있었어요. $$Brunch$$닭가슴살 바질페스토 파스타 추천 샌드위치류 브런치는 속이 많아 맛은있지만 먹기힘들다$$아이스 아메리카노 / 아이스 그린티 라떼
244820280|뷰클런즈|$$맛있고 분위기 좋고 직원 분이 너무나 친절해서 기분 좋았어요^__^$$새소리와 감미로운 째즈음악 ! 볕들어 오는것도 너무 예뻐요 휴식&힐링이 어울리는 카페예요 커피도 쿠키도 맛있어요 $$블루베리 라떼.... 진짜 신기하면서 맛나네요$$이색적인 차 종류가 많았고 초콜릿맛이 나는 커피는 진짜 특이하면서 맛있었어요! 이 커피는 식으니깐 더 맛있는 기분이였어요  직원분들께서 매우친절하셔서 더 기분 좋았던곳! 다음에는 디저트도 함께 먹어보러 갈꺼예요:-)$$밀크티 맛나욤!!  케이크도 잘 포장되어있어서 좋고 맛은 무난해요~ $$2층 공간 취지랑 달리 너무 시끄럽네요 ㅠㅠ 한번씩 올라오셔서 관리좀 해주세용 컨셉 보고 조용한 공간 필요해서 왔는데..  공간은 예쁘고 커피도 맛있어요!$$다양한 차종류가 있습니당 밀크티가 맛있어요 차도! 분위기도 좋고, 카페에 담긴 스토리가 좋슴니다$$사람은 많지만 조용하고 사방이 향긋하니 티를 마셔야만 할것같은 아늑한 분위기가 맘에듦 $$조용하고 밀크티 맛있음$$$$조용해서 목소리 묻히는 타입인 나같은 사람들이 얘기하기 좋다.  의자는 푹신하지만 테이블이 낮고 옆자리랑 분리된 느낌이 없어서 좌석이 편한 건 아니다.  원목으로 이뤄진 인테리어는 예쁨 빵이랑 음료는 평범 이상..? $$흑임자케익 최고존엄 ㅠ$$여기 오는 커플들 제발 정숙 좀 하세요 떠들거면 일반 프랜차이즈 카페 가시던지 ㅋㅋ 데시벨 조절 못하는 성인들 많음 노키즈존은 무슨 ㅋㅋㅋ 이런 사람들도 출입 금지 시켜야함 공간, 인테리어, 서비스는 다 좋아요 직원분도 상냥하시고 되려 기분 좋아짐..  손님들만 알아서 조용히 하면 될듯 제발 조심해주세요 ^^$$공간이 정말 예뻐요 사장님이 카페 구석구석 모든 걸 신경쓴게 느껴집니다. 대화하기도, 책읽기도 좋은 카페에요$$맛있어요!!!! 근데 너무 계단층간격? 이 넓어서 무서워옼ㅋㅋㅋㅋ 그래두 맛있어서 별4개!!!$$조용하고 좋음 시그니처랑 쇼콜라떼 최고;; 화장실도 아주 깨끗함$$커피랑 음료 다 맛있고 직원분들이 넘 친절합니당$$커피 맛있음 두 잔이나 마심 화장실 디자인 예쁨 $$특색있지만 디저트쪽 라인업은 별로인듯$$$$음료 디저트 공간 다 좋아요$$노키즈존$$차분한 분위기가 좋았습니다. 직원 분께서도 참 친절하고 차분하게 음료 설명을 해주셨어요.$$$$뭔데 콜드브루 맛있지..$$아늑하고 좋아요! 커피도 맛있고 공간컨셉이 확실ㅎㅎㅎ$$콜드브루 진짜 엄청 맛있어요ㅠㅠ 스트로베리 초콜렛 콜드브루 마셨는데 향 진짜 대박ㅠㅠㅠ$$$$흑임자 갸또 진짜 미쳤어요.......먹어본 케이크 중에 손에 꼽습니다,,,,커피랑 솔티카라멜 쿠키도 진짜 맛있었어요!! 1층 소파자리도 넘 편하고 조용해서 힐링 하구 왔습니다! $$$$전체적으로 조용한 분위기. 북카페와 카페 사이의 오묘하면서도 감각적인 인테리어. 여러 작가와 책의 글귀가 적힌 카드도 받을 수 있고 밀크티가 맛있다. 다만 자리가 편하다는 느낌은 받지 못했으며 콘센트도 부족하다고 느꼈다.$$$$두개씩 겹쳐진 종이컵이 감각적이긴 하지만.. 환경을 생각해주면 더 멋진공간이 될것같아요!  빨대도요.. 라떼 최고 맛있었어요! 다만 밀크티는 복숭아향이 너어무 쎄서.... 목에 샴푸 부은 느낌 (호불호 강할듯요) 조용히 사색하는 분위기가 진짜 좋아요, 조용히 말하지 않는 사람들도 있긴 합니다.. $$음료맛보다는.. 사람이 많아도 시끄럽게 얘기하지 못할것 같은 정적인 분위기가 좋았다.  중간에 한번씩 힐링되는 향을 피워주는데 마음이 평온해지는 향.. 이었다.  우연히 수박이왔어요~하는 트럭이 앞에 자나갔는데. 카페 향과 정적인 분위기에 취해서 불경읽는 소리로 드릴만큼..그런 느낌같은 느낌. ㅎ 추천$$그냥 지나칠 수 없었던 본능적으로 이끌렸던 카페, 바쁘고 정신없는 일상을 잠시 뒤로하고 잠깐의 쉼이 필요한 사람들을 위한 느린 공간$$씨솔트 초코케이크 콜드브루$$$$편히 쉬다 갈 수 있는 좋은 카페 같아요. :)$$정말 좋아요 자주 오고 싶음$$최고. 시럽을 통한 인위적인 맛이 덜하여 약간 묽다는 느낌도 있지만 꽃향기가 물씬나는 새로운 맛의 밀크티. 스웨디쉬 감성인지 사우나 한약재 향이 은은하게 퍼지는 원목 인테리어.$$아 진쨔,, 넘 죠아요,, 사실 그냥 인스타 카페인줄 알고 기대 안했는데 ㅠㅠ 평일에 한적하니 정말 힐링 그 자체 ෆ ෆ ෆ,, 직원분들도 친절하시고 스윗라떼 넘 취향저격이에요 ,,, 편한 의자들은 아니지만 나름 자리도 구석구석 많고 특유 향이랑 분위기 너어무 좋아요 ෆ ෆ $$$$친구 대접할려고 이곳저곳 찾아보다가, 한번 가봐야겠다〰️ 하며 도박으로 간 곳이었는데, 기대 이상이예요〰️〰️ 굿즈도 좋고, 음료도 좋고, 인테리어도 좋고, 분위기도 엄청 좋은 곳입니다. 대왕추천〰️〰️〰️!$$매장 이쁘고 커피맛 좋아요 $$조용하고 향기롭고 분위기좋고 맛도좋고 영업한다는것에 고마움 커피가…진짜맛남$$기대보단 커피가 괜찮고 티도 맛있음 가격은 좀 아쉽다$$ $$매장 분위기도 너무 좋고, 판매하는 제품들도 직원분들도 엄청 친절하고!  밀크티랑 스윗라떼마셨는데 진짜 맛있어요! 집앞에있으면 진짜 자주올 카페ㅠㅠ$$$$Coffee by myself $$커피만 더 맛있는곳은 아마 있을것같다 그래도 마시는동안 더 맛있는 커피가 생각나진 않는다 공간은 자연스럽고 신선한 느낌을 줬다 인구밀도가 높아지면 장점이 희석되지만 혼자 느긋히 독서해도, 좋은사람과 대화해도 좋은$$조용하게 쉬고싶을때$$분위기도 좋고 커피도 맛있었어요~~ 햇빛 좋은 날 가시는 걸 추천드립니다$$좋았어요. 사람이 조금 많은편이었지만 분위기만 낸 카페가 아니라, 티 종류도 다양하고 찻잎향이 너무 좋아서 또 가고싶어요.$$카페 분위기가 조용하고 깔끔해요 휴식에 관해 철학적인 메세지들이 인상 깊었어요 친절하고 잠실 올때마다 들르고 싶은 카페 :) 스윗라떼 추천$$조용하고 힐링되고 커피맛있고 아늑하고. 참 좋은 카페였어요. 조용조용 이야기하는 카페! 그리고 공간이 예술적이라서 볼게 많아요 나날이 업그레이드 되는 느낌$$음료 맛없고 창렬. 밀크티 맛보고 너무 충격받았네요 감각 느끼러 간다하면 갈만할듯$$$$커피가 비싸다 양도 적다  그래도 재방문 하게 된다 내 자신이 밉다$$$$너무 좋다고 소문안나길ㅋㅋㅋㅋ나만알고싶은장소$$음료는 약간 비싸지만 감각적이에용 $$커피가 맛있어요 인테리어도 이쁘고 분위기 있음  좌석은 좀 불편함 ㅠ$$비건베이커리 있어서 좋아요  카페 내부도 넓어서 조금 안심이되었어요 나무냄새같은게 나서 편안하고 안에 볼거리도 많아서 좋네요~$$$$노키즈존인데 성중립화장실 ㅋㅋㅋ $$$$$$그냥 저냥 ㅎ$$분위기 좋은 카페. 인테리어도 너무 예쁘고 배치한 소품도 예뻤어요. 2인이상 왔을경우 다소 앉을 공간이 마땅히 없지만 그거빼곤 다 좋았어요. $$오롯이 커피와 나에게 집중 할 수 있는 곳 아무것도 하지 않아도 아름다운 곳 직원분들이 정말 친절하게 하나하나 설명해주십니다. 다만... 1층(수다) 2층(조용히 커피 마시는 곳)으로 구분이 되어 있는데 간혹 2층에서 시끄럽게 떠드시는 분이 계셔서 조금 아쉬웠습니다.$$개성넘치는 카페$$저 여기 좋아하는데.. 컨셉은 쉬는 곳인데, 너무 시끄러워요. 평일 낮에 가야지 좋아요. $$너무 불편해요. 커피는 정말 맛있어요. 테이크아웃하세요. 인스타용입니다.$$카페 분위기도 너무 좋구 커피도 너무 맛있고(라떼, 밀크티) 친절하셨어요. 정말 좋았습니다$$분위기나 인테리어가 좋다. 아늑한 느낌도 든다. 단점은 커피 가격이 양과 맛에 비해서는 좀 비싸다. 조용조용해서 카페 자체는 좋음$$커피맛이 엄청 좋아서라기보단 내부의 적당한 널널함이 맘에든다.  좌석은 요즘 스타일로 불편함.   라떼 괜찮은편이고 아메 조금 고소하고 쓴맛. 스웨디쉬아메가 좀 독특했다.  이주변 커피점중 그나마 갈만한곳. $$송파동 스웨덴카페 분위기 좋음 밀크티  추천.  커피는 쏘쏘 분위기에 비해 커피맛이 많이 아쉽네요$$브랜딩이 훌륭한 카페. 고오급 브라우니는 맛있지만 조금 비싸다. 스웨덴 밀크티는 오묘한 플로랄향이 인상적이나 제 입맛에는 안맞았어요$$가야는이유 : 조용한 분위기와 안락한 인테리어로 맛을 의심했지만 괜찮은 편 안가는이유 : 괜찮은 카페들이 나란히 붙어있는데 그 중에서도 가장 먼저 자리가 차는 곳  스웨덴 원두와 제품들을 사용하고, 스웨덴이 들어간 메뉴는 스웨덴설탕이 추가된다고 보면 됨, 대화를 조용히 해야하고 시끄러운 손님들은 신고도 할 수 있어 나름 조용한 분위기 유지, 다만 장시간 앉...$$$$장점 : 짧은 시간 분위기 있게 쉴 수 있는 곳 단점 : 테이블이 거의 없고 등 받이 없는 일자형 의자가 대부분(장시간 앉기 불편)$$이런 카드도 하나씩 뽑을 수 있는게 좋았어요~ 두번째 방문이에요!$$행복한 공간, 언제와도 휴식할 수 있는 곳$$짱 좋음 !!!! 다음에 방문하면 꼭 스웨덴 라떼를 먹어야겠어요!$$휴식하기 좋음 곳 귀도 조용합니다 카페치고는$$$$송리단길 근처 2층 주택을 개조한 (아마도) 갤러리 카페. 현재 최예지 작가의 일러스트 원화를 전시하고 있다. 우드 패널로 마감한 인테리어가 편안함을 주며, 대체로 조용하다. 주문 시 작은 목소리로 대화할 것을 권유하며 2층은 노키즈존이다. 혼자만의 아지트를 찾는 사람이라면 누구나 만족할 듯. 커피 맛도 괜찮다.$$커피에서 빛이난다. 스웨덴-드립커피 덕에 라이트로스팅의 맛을 알게되었고, 스웨덴-스윗라떼는 나의 인생라떼가 되었다. 휴일기분을 마음껏 누릴 수 있는 공간 <3$$스웨덴라떼 진짜 맛있어요$$에이드 먹었어요. 아주맛나오 근데 카페 컨셉이 그런건지 조용한 음악만ㅠ 조용한 분위기 컨셉이라 그런거같아요 그것도 음악이 여러가지나오는게 아니고 한시간좀지나면 같은음악이 다시나오드라구여. 음악만빼면 다좋았던.. 선곡이 좀 졸려요 책읽어야 할거 같아오 대화도 조용히해야함ㄷ니다 편안히 쉬기 좋은 카페에요!!!!$$$$$$조명과 목재로 인한 따뜻한 느낌, 편안히 쉬다 갈 수 있는 등받이 쿠션, 생각에 잠길 수 있는 좋은 글귀.  아쉬운 점은 2층 화장실옆 전시공간 조명이 어두워서 글을 읽기가 불편한 것 빼면 좋음.
