URL_ID|카페명|리뷰
1709558766|호랑이|$$꼬소한 라떼  가격도 적당하고$$$$오늘은 우유꼬소함이 덜했음….  맛이 변한게 아니길$$$$주문마감이면 들어올 때 얘기를 해주던가 .. 어이없음$$커피맛은 고소하고 맛있는데 빵이 비싸다…  카페 분위기랑 노래랑 잘 안어울린다$$아이스 호랑이라떼 맛있음. 가격도 적당함. 사람 덜 붐빌 때 가야 제대로 맛있음. 내 앞에 웨이팅 50명쯤 있을 때 갔더니 평소보다 덜 맛있었음.  후르츠산도 괜찮음.$$아이스라떼 정말 맛있어요! 진짜 고소함$$종로 근방 오면 꼭 들리는 곳. 커피는 잘 모르지만 라떼가 꼬소~하이 맛있당$$기대이하$$왜유명한거지....$$은은한 버터향에 아주 살짝 감도는 단맛이 맛있는 라떼$$진짜 꼬숩한 라떼 존맛... $$$$$$$$유명세만큼은 아니지만 그냥저냥 먹어볼만합니다 $$$$라떼에서 쓴맛과 단맛을 뺀맛입니다...$$호랑이카페 , 행2pm8pm 와인바 , 진작 을지로 세곳 대표 핫플 추천~~ 꼭 가보세용$$일욜 휴무ㅜ$$라떼 맛집! 후르츠산도는 평범$$특별한 라떼맛, 특별한 위치$$아이스라떼 지일 맛있음$$탄 죠리퐁 녹인 맛? 같았어요$$행2pm8pm 와인바 코스로 아래 어떤분 추천으로 다녀갔는데 힙지로스러워서 만족했습니다~! 행2pm8pm에는 와인마시면서 공연이 정말 좋았엇어요!! $$가성비 라떼$$$$역시 커피는 호랑이$$$$호랑이 기운이 솟아나는 라떼는 아니지만 시그니쳐 ㅇㅈ 이 집의 맛은 여기말고 못 느낌$$가성비 치고 굉장히 맛있는 라떼 같아요 좋네요$$$$좋았습니다! 유쾌한 시간 보낼 수 있게 해주셔서 감사합니다!$$손님인 내가 슈퍼을이야 넌너무맛잇어ㅠㅠㅠㅜㅠ$$초심잃은듯 은근슬쩍 양적어지고 묽어짐.. 처음에 느꼈던 감동 없음.. 유명무실 사람만 많아짐 최애라떼맛집에서 다신안가는 집이됨$$$$노맛$$생각보다 라떼가 특색있진 않습니다$$표시한 영업시간과 실제 영업시간을 확실하게 정해주세요. 맨날 갈때마다 문이 닫혀있네요 ㅡㅡ$$$$라떼 못잃어... 진짜 너무 맛있어요! 가격도 굿! 양 많은것도 팔았으면 좋겠다~~~~~~~$$매너없이 장사하고 라떼 맛 없음$$또생각난디뷴명히$$라떼존맛ㄹㅇ$$라떼 원탑$$라떼 너무 맛잇네여$$라떼에 먼가를 섞은듯한 맛? 먼지 궁금해요ㅎㅎ 잘꾸며져있고 공간은 굉장히 협소해요 테이크아웃해서 먹는걸 추천해요 양은 적어요ㅠㅠ$$$$$$걍 프랜차이즈 커피 마시다가 기분전환 겸 마시면 좋은거같다. 실내는 생각보다 너무너무 좁음.. $$좁아터진 공간에 마스크 벗고 바글바글 왁자지껄해서 1점 주고 싶으나 시원하고 진한 라떼맛은 5점 만점 근처면 맨날 갈듯.$$$$$$$$라떼 맛있음$$$$근처면 먹고 멀리서 와서 먹을 라떼 맛은 아니에요~~ $$이러저런 평가가 있었는데 맛이 변했대도 더 변하기 전에 가자며 찾아 갔어요. 근데 생각보다 넘 맛있었어요 짱짱 다른 라떼 먹기 싫어질 정도? 근데 문제는 라떼가 잔의 50%밖에 안 들어 있있다는 거에요. 첨에 보고 누가 먹다 남긴 거라고 생각했어요. 사람이 넘 많고 주문 받는 쪽 사람도 많아서 별 말 못 했는데 후회돼요... 1750원만 받았다면 5점이었을...$$가는 법: 을지로4가역 1번 출구로 나오기 → 버스 정류장 지나서 꺾기 → 동6번 계단 올라서 3층으로 가기(유한철재 앞쪽에 계단 있음)  일반 라떼보다 고소하더라고요! 폴바셋 라떼느낌... 맛과 3,500원이라는 가격은 좋았지만 대기가 있고(휴일 기준 30분) 가게 내에서 마시기 어려워서 다시 방문하진 않을 것 같습니다ㅋㅋㅋ$$라떼 가격 착하고 부드러워서 괜찮았다. 색다른 경험. 한번쯤 먹어볼만한 라떼라 생각은 한다.$$$$라떼 ㄹㅇ 개존맛 일찍 닫아서 아쉬워요$$계속 가보고 싶어서 찾아갔는데 역시나 사람이 많더군요,,, 제가 갔을땐 밖에 테라스 자리가 없었는데 원랜 있나요??? 없다면 만들어주셨음해요 담엔 꼭 커피 먹어보고 싶거둔요$$$$호랑이라떼 진짜 고소하고 맛있었음 별로 안 달고 놀랐음  커피는 신맛나기때문에 호불호가 갈릴거 같음 그래도 나는 맛있었음  가격도 합리적이고 분위기 좋음$$좁아서 겨우겨우 낑겨 앉았지만 정말 고소하고 맛있던 커피.  전 아메리카노 마셨는데 같이간 언니가 마신 라떼도 정말 고소하고 맛있었어요. $$을지로 감성.$$$$꼬숩 달달해요 굳이 찾아가서 마실정돈 아니지만 근처가면 찾아갈 정도는 되는 맛 이라고 생각해요 앉을자리 없는게 단점$$음 라떼를 많이 안먹어봐서 그런진 모르겠지만 특별한지는 잘 모르겠어요$$달달한 라떼에 부드럽고 고소한 맛이에요 날 좋은 날 갔는데 또 가고 싶어요$$$$어떻게 이럴 수 있을까 2년전이 마지막인데 그때보다 심지어 더 맛있다. 대단하다. ㅠㅠ 요즘 산미있는 커피만 입맛에 맞는 줄 알았는데  오랜만의 방문에 눈뜨이고 간다$$라떼 괜찮았어요 하지만 가게도 너무 작고 북적거리고.. 라떼를 먹으러 여기까지? 찾으러 가진 않고 근처 볼일 있으면 갈듯$$아이스라떼 엄청 맛있어요 $$진짜 고소하고 줄서서 꼭드세여$$$$근처오게되면 꼭 들려요 꼬숩고 저렴하고 특이해요 $$$$라떼가 아주 꼬숩구먼요$$$$최애라떼 $$호랑이라떼 달달한맛임. 마치 맥심으로 라떼를 만든것 같은 느낌$$할말하않$$라떼는 괜찮았고, 아메리카노는 그저 그랬음. 그리고 8시반 이후 들어오는 손님은 마감이라고 안 받던데, 어느 순간 직원 3명이 한꺼번에 사라져서 나갈때 보니 3-4블럭 옆 매장 앞에 앉아서 놀고있었음. 직원들이 놀러간 그 후에 들어온 손님은 직원이 없으니 두리번거리며 마냥 기다리던 모습은 좀 아닌 것 같았음. 분명 손님 기다리며 방황하는 모습 뻔히 보이는 ...$$호랑이라떼 좋앙 꼬수워 너무너무 꼬수워 어떻게 만드는지 알고싶엉 집에서 매일매일 만들어 먹고 싶엉$$고소하다 진짜 고소하다 사람이 많이 방문하고 비좁지만 생각나는 맛이다 계속 생각나는 카페라떼 맛이다$$평소에 커피못먹어서 달달한 카라멜마끼아또만 먹는 사람임. 시럽없는 카페라떼가 이렇게 맛있는 적은 처음이었음. 너무 고소하고 뒤에 쓴 맛이 전혀 안남. 가격도 너무저렴. But, 산미를 중요시하는 분들은 비추천. $$$$마이 페이보릿 라떼$$$$여기 평점 진짜 왜이래요...? 가격대비 존맛인데 ㅜ 데려간 친구들 모두가 인생커피 등극한 곳인데..$$$$우유에 뭔 짓을 한 건지 너무 궁금해지는 맛 맛있음.$$후르츠 산도 느끼해요 라떼 맛있어요 $$$$토왜빠들 소굴 징그러워라!$$라떼 맛있음 공간 좁음$$가격이 저렴해서 좋았어요$$라떼 엄청 싸요....! 그리고 엄청 꼬숩꼬숩...매장안은 좁아서 밖에서 드시길 추천!!힙한 을지로뷰:) 근데 여기 찾기가 너무 어려워요...한참 헤메다 발견...!$$쫍쫍굿$$라떼 진짜 최고 역대급$$오랜만에 왔더니 컵크기가 검지두마디이상 줄음ㅋㅋㅋㅋ 왼쪽은 오늘 오른쪽은 작년사진임.. 그리고 끝맛에 쓴맛이 더 입에 남아서 거슬려짐... 라떼는 여전히 일반가게들보다 낫긴한데 점점 이제 여기까지 굳이 와야할 매리트가 사라짐...$$평점 웨이래요..? 여기 존맛탱 맛집인데.. 나의 인생 라테... 나만 먹어야겠다..$$$$원래 커피를 마시지 않는데 여기서 라떼 먹어보고 커피도 맛있을 수 있구나 하고 커피를 마시기 시작했어요. 라떼가 어디서도 느껴볼 수 없을 만큼 굉장히 고소합니다. 원두랑 우유만으로는 절대 이 맛이 나지 않을 것 같은데 비법이 무엇인지 궁금해요. 커피헤이터인 제가 라떼 러버가 되다니 믿을 수가 없어요. 아이스를 많이 드시고, 추천하시던데 저는 따뜻한게 더 맛...$$작년 한 해동안 진짜 근처 지나갈 일 있으면 무조건 들러서 한 잔 씩 마셔서 10개 찍은 쿠폰도 여러개 채워서 공짜로 마셨는데 최근 사람이 너무 많아져서 몇달 못 먹다가 간만에 마셨는데 예전 그 맛이 아니예요. 조리퐁 껍데기 가루 섞은듯한 꼬소하고 중독적인 맛이 일품이었는데.. 그냥 저냥 평범한 라떼맛이 됨. 사장님에게 레시피나 원두.우유 바꾸셨냐 여쭤봤는...$$$$라떼가 유명해서 갔는데 그냥 보통이었음 왜그렇게 유명한지 모르겠음  내부도 너어무 좁아서 앉아서 마시긴 하늘에 별따기$$내부 너무 좁지만 세운상가 덕 많이본듯$$그냥 말도안되는 컨셉이에요 샌드위치놔두고 산도쓰시고, 일본인들이 일제강점기때 우리나라 호랑이 어떻게하신지는 아시고 이름지으신건지..?? 인스타보니 일본에배울게많다고 하시던데... 아이러니투성이인 가게같습니다 요즘시국에$$산도,,,? 여기가 일본도 아니고 좀 거부감 듭니다.$$$$맛 변함. 레트로를 가장한 비위생적+불친절  후르츠 산도라는 기괴한 작명 뭔지.. 걍 딸기샌드위치라고 해도 되겠고만  자리 3자리도 없어요. 가게 후져요 편의점 커피 드세요$$라떼 너무 취향$$아아만 먹는 내가 왜 라떼를 시켰을까$$라떼맛은 좋은데 양이 엄청 적네요. 3500원이라 그런가요. 힙!하단 표현이 딱 맞는데요. 뭐 그닥 굳이 또 찾아갈 커피맛집은 아니고 유행 따라 한번쯤 갈 만 합니다. 시국이 시국이니만큼 매장 내 커피 내리는 분들 마스크 해야 하는 거 아닌가요. 턱스크 노놉.$$꼬소하긴한데 다시오진않을듯$$음.. 커피 맛 괜찮긴 해요. 딱히 특별한 건 없지만 한국에서 잘 안 파는 맛. 직원분들 친절하진 않아요. 사람 많으면 테이크아웃 해서 청계천에 앉아서 드세요. 후르츠샌드라고 해도 될 걸 일본어로 산도라고 적으니 약간 거부감 듭니다.$$근처에 있다면 테이크아웃해서 먹을만합니다. 라떼 3500원, 달아요. 연유랑 우유 섞은 것 같아요. 이 맛을 기대했던 건 아니라 당황했습니다. 아래 빽x방과 동일한 맛이라는 평에 동의합니다.   내부는 매우 좁고 사람도 많아서 솔직히 코로나 걱정이 좀 들었어요... $$세번 갔는데 항상 꽉 찼어도 커피 웨이팅은 없었어요! 대신 주말 붐비는 시간에는 자리 찾는게 힘들더라구요 실내는 너무 좁고 협소해서 야외 자리가 나아요ㅠㅠ 딸기산도는 평범한 맛이였는데 라떼가 달기보단 크리미하고 고소해서 맛있었어요 가격 (3.5)까지 생각하면 테이크아웃은 한번쯤 꼭 해볼 만 한 것 같아요 :-) $$19년 초반에 일주일에 몇번씩 가서 사먹을 정도로 좋아했는데 언제부턴가 맛이 바뀌어서 안가요 아쉽$$커피는 전문 분야가 아니라 조심스럽지만 무난한 맛 줄 서거나 할 이유는 없다고 생각$$일단 좁아터짐. 3명이서 갔는데 테이블 째끄만 거 한개 나눠 쓰라 함. 그것도 한명은 복도 쪽에도 못 안고(복도 너무 좁아 터져서 복도에 앉으면 아무도 왔다 갔다 못해서) 옆쪽으로 찌그러져서 앉아야함. 커피 맛도 라떼 그냥 평범 그.자.체. 사진 보면 음식 찍었는데 옆 테이블, 반대편 테이블 다 나올정도로 비좁  First of all it’s so dam...$$가게 너무 좁고 찾아가기도 힘들고 사람은 너무 많고 가게 안은 덥고 테이블 간 간격이 10센티임 사회적 거리두기 전혀 안되고 가게가 좁아터졌는데 가운데 길 내라면서 자꾸 손님들한테 비키라함 직원 넘 띠꺼워요 지들 잘나가니까 갑질하는 느낌 테이블이랑 의자도 좁은데 구석에 구겨앉아야하고 라떼는 특별한 맛 아님. 샌드위치도 평범 인기가 왜 많은지 전혀 이해가 안...$$커피도 별로 샌드위치도 별로 직원은 띠꺼움 왜 유명한지 모르겠음$$라떼가 맛있네요$$호랑이라떼로 유명한 집. 3500원이라 맛집치고 저렴한데 양이 적어서 금방 없어진다. 자리는 운 좋아야 앉을 수 있음. 맘편하게 테이크아웃 추천. 찾아가기 불편해서 재방문은 안함. 맛 : 살짝 감미가 도는 단맛인데 달달까진 아님. 고소함이 도는 단맛. 여기서만 맛보는 라떼라 한 번은 가볼만하지만 크게 임팩트가 없었고 양이 아쉬움ㅠ$$평범했어요 $$$$웨이팅 1시간$$이 카페의 레트로함은 세운상가에 있습니다. 발전된 도시에 오래된 건물사이에서 운치를 느낄 수 있지만 카피와 샌드위치에 특별함은 없는 것 같습니다.$$굳이 찾아갈 이유는 없는 카페. 이 정도 맛의 커피, 이 정도 인테리어는 주변에 널렸고, 테이블 갯수와 배치에 비해 공간이 많이 협소하며 산도는 재료가 다 따로 논다. 저게 맛이 없을 수 있구나,, $$크게 거슬리는 부분 없이 맛있는 맛의 달달한 라떼였다. 공간이 너무나 협소해 절대 앉아서 마실 수는 없을듯. 무조건 테이크아웃 해야... 웨이팅을 길게 해서 마실 정도는 아니다.$$The drinks are good, but not good enough to make up for the horrible layout of the tiny cafe.  There is one too many table in too small a space. This means that whomever has the misfortune on getting ...$$양이 작긴하지만 그만큼 저렴하기도하고, 라떼가 되게 고소했어요! 굿!$$달달한라떼인줄 몰랐음$$자극적이지 않고 약간 고소한 맛$$라떼맛집! 협소한곳이라 무조건 텤아웃$$그냥 커피집ㅎㅎ 저렴하고 좋아요. 사람이 많을 땐 패스$$진짜 너무 좁고 테이블 미끄럽고 커피때문에 1점이지 커피만 아니었으면 다 마시지도 않고 나올정도임 식탁보를 좀 고정만했어도 나을듯$$$$사람이 정말너무많아서 바쁘신건 알겠지만  과도한 일회용품 사용 (포크대신 물티슈를 주시고, 테이크아웃이아닌데도 플라스틱빨대를 꽂아주시는부분)은 좀 아쉬웠습니다.  라떼는 맛있었어요!$$가격대비 최고의 커피 입니다.  다만 샌도는 좀....  커피는 가성비 최고의 집. 단 자리가 협소한것은 안타까움$$라떼만 마시는데 먹어본 라떼중 최고에요 다만 매장은 좀 번잡스러우니 테이크아웃추천! $$사람너무많고 웨이팅 기본 15분~30분 라떼먹어야됨 아메리카노 너무 저세상 산미$$$$커피존맛. 주말 저세상 웨이팅. 30분 기다렸지만 상쇠될 정도로 맛있었어요. $$엄청불친절합니다 여행첫날기분다배림 맛도걍평범$$별로예요 이거먹자고 멀리서는 안갈듯~ 요즘 플라스틱 쓰지마라는데 플라스틱에 줌. 아메리카노가 시큼해요 흠   쥬스에 커피살짝들어간맛 일반 아메 신맛하고는 완전히 달라요 라떼는 배고플때 마시면 좋을듯 우유반커피반 그정도~ 여유있게 앉아서 음악듣고 커피마시고온다? 는 꿈도꾸지마시길 좁아서 앉을자리도 없음~ 기다려야함$$라떼$$커피맛은 최고$$처음 생긴후로 꾸준히 다녔는데, 맛은 시그니처이니다. 하지만 좁고 불편한 손님에게 직원인지 사장님인지는 짜증를 냅니다. 좁으니 한줄로 서서 주문하세요. 좁으니 나가서 대기해주세요. 짜증섞인 말투. 그정도야 뭐! 하지만 춥고 더운날에대한 배려가 전혀 없네요. 전 다신 안갑니다. 커피 맛과 질이 중요하지만 불친절한 서비스를 이해해줄 만큼은 아니네요.$$라떼 생각보다 그냥 그랬고, 과일산도는 정말 맛있었음 생각보다 정말 좁음 인스타인간들 계속 사진 찍어대서 실수로 같이 찍힐까봐 불편함 ㅠ$$예전엔 맛있었다고 하던데 지금은 잘 모르겠음 평범한 커피. 쉴새없이 찰칵찰칵 소리가 들리는 곳$$라떼가 고소하니 진짜 맛있었어요! 주말은 사람 정말 많아요..$$그냥은 갈만한테 웨이팅할맛은 아니에요$$아아.. 시다$$노서비스, 호랑이 라테는 그런대로 괜찮은데 아메리카노는 시큼한 향이라 별로.$$레시피 궁금쓰 라떼맛집$$커피 맛있고 노래 좋은데 매장내 일회용컵에 사용 신명나게 함! $$매장 분위기는 좋지만 너무 좁고 라떼맛도 특별하진 않음 둘이 갔는데 자리가 없어서 테이크아웃으로 한잔 주문하니  어이없어하며 정말 한잔이냐며 재차물음, 다시 안가면 됨$$가격이 저렴하고 분위기 있어서 예쁘긴한데 진짜 자리 엄청좁고 딱히 일부로 찾아갈만한 메리트 있는 곳은 아닌듯 ㅠㅠ$$그냥 라떼,, 지나가다가 사먹는거지 그 이상 뭐 없는듯 가게는 좁아서 다닥붙어있고 그냥 테이크아웃해서 나왔어요$$$$Ice Latte$$어흥$$호랑이라떼강추..분위기도 너무좋았어요ㅠ$$ 일반 라떼보다 약간 달고, 내부가 비좁지만 한번쯤 가볼만한 카페$$이렇게 맛있는 호랑이라떼가 3500원?$$라테 대존맛인데,, $$$$점심시간에 사람 엄청 몰리네요. 맛은 평범$$$$여기 커피 별로라고 해서 기대를 안했던 건데  생각보다 연유가 들어간 아이스라떼가 달달하니 당충전 가득함. 세운상가의 취지도 좋고 같은 라인에 클래식 오락실도 있어서 잠깐 소화시키기 위해 들리기는 딱. $$보통 분위기는좋음 사장님존잘$$아이스 라테 맛잇습니다. 우유와 두유가 섞인 맛 아주 약간 우유에서 단맛이 느껴집니다. $$$$가야는 이유 : 아이덴티티가 확실한 카페 안가는 이유 : 커피맛이 최상은 아님  후르츠산도 맛 색 플레이트 조화가 최고 3층에서 발코니쪽 밖으로 나오면 보임$$대림상가 속 의외의 카페 ㅎㅎ 고풍스런 분위기와 멋쟁이 사장님 그리고 가성비 괜춘한 커피! 나름 만족함^^$$
