URL_ID|카페명|리뷰
170158577|커피사|$$을지로에서 가장 좋아하는 카페입니다..! 낮에 가면 채광이 좋아서 따사로운 느낌이 좋아요. 너무 조용하거나 너무 시끄러운 분위기가 아니라 편하게 얘기 나누기 딱이에요! 혼자 방문해도 여유롭게 시간 보내기 좋습니다  지금까지 밀크티, 아인슈페너 마셔봤는데 둘다 맛있었어요. 특히 아인슈페너 위에 크림 정말 맛있으니 아인슈페너 좋아하는 분들은 꼭 한번 드셔보세요...$$드립커피 맛있네요 구웃$$직원분들 딱 적당히 친절하고 공간이 아늑해요 ! 음료는 가격에 비해 양이 적고 처음에 이곳이 맞나?하고 계속 들어가서 올라가면 나와요$$카페 넘 예뻐요 딱 을지로 갬성$$분위기 좋지만 친절하지 않은 직원 바나나 브레드는 꽤 맛있었어요  굳이 꼭 주문할 필요는 없구요$$커피 넘 맛있어요! 라떼 먹었는데 라떼도 칼리타 서버에 나오는게 특이햇어요:)$$커피도 넘 맛있구 바나나케이크 존맛... 꼭 가서 드세요.... 따뜻한 드립커피 진짜 대추천... 바나나케이크...못잊어요... 분위기도 진짜 미쳤어요.  갬성 장난 없음.$$조용하고 차분한 분위기가 좋았고 커피도 맛있어요. $$$$을지로에 몇안되는 조용하고 넓은 카페$$디카페인 먹을 수 있어서 좋아요$$커피가 너무 맛있었어요 ㅠㅠ$$아인슈페너 맛있고 귀여웠어요!  아침일찍 갔는데 친절하시고 좋았어요$$드립커피 깔끔한 맛이 너무 좋아요  바나나케이크도 아이스크림이랑 맛나요 $$알수업슴$$$$메뉴판 어딨냐 하니까 턱으로 안내하던 사장님의 멋짐에 감탄하였습니다 $$평일 낮 사람 없는 시간대에 가는 걸 추천해요!$$바나나 어쩌구 빵 너무 맛있다. 또 생각난다. 올라가는 길이 재밌던 카페...$$가격좀낮차요$$$$커피에서 떫은 맛이남. 기분이 나쁠랑 말랑..$$흔한 인스타 감성 카페입니다.. 음료 양 적고 맛도 그냥 그랬네요..$$커피 디저트 공간 음악 채광 위치 걍 다좋음$$$$듣던대로 찾기 쉽지는 않음 뒷문으로 가서 사층까지 올라가서 반대계단으로 내려와서 이용했고 건물3층까지 암모니아냄새나요 물론 카페에선 안남 딱 을지로감성 카페에요ㅋㅋ조금 많이 낙후되있는 건물 빈티지한 소품들..아인슈페너 크림은 진짜 인정 티슈도 귀여움$$아늑하고 따뜻하고 친절하시고. 아인슈페너도 맛있지만 초코라떼도 맛있어요 찾아가긴 힘들지만 나름 그것도 매력!$$전형적인 을지로 커피집. 을지로 커피집 느낌이 궁금하다면.$$찾아가기 좀 힘들지만 여기만의 독특한 감성이 있다$$감성은 있고 맛은 없다. 디저트 토핑인 하겐다즈 아이스크림이 제일 맛있다.$$커피 맛있고 친절해서 조아용 $$근처일 때 오세요.$$맛있는데 식기에서 물비린내남.$$아인슈페너 충격적으로 맛있음. 조금 시끄러움.$$분위기가 아주 좋ㅇ아요$$찾아가기 힘들지만 분위기는 좋아요$$주기적으로 가고싶은 카페. 편하면서 묘하게 매력적인 곳이에요. 커피도 맛있어요.$$$$$$가게가 찾기 힘들다는 단점이 있지만 을지로만의 공간스러움과 조용하고 잔잔한 매력이 주는 느낌이 좋았습니다$$가게도 너무덥고 찾아가기도 힘들고(후문을 미로로 만들었으면 입간판을 안세워야되지않나) 가격에비해서 양 진짜 너무적고 플레이팅도 별론데 맛은 평범했어요$$바나나케이크 ( ⸝⸝⸝⁼̴́◡︎⁼̴̀⸝⸝⸝) $$$$바나나케이크가 진짜 너무 맛있어요 또올거예요 진짜 진짜로요$$<하나 시켰다가 한 입 먹고나서 하나 더 시키러 가게 만드는> 바나나케이크$$사장님 혹시 이 글을 보신다면 메뉴판에 기재되어있는 해당 메뉴명 변경 부탁드립니다 이걸 그냥 바나나 케이크 라고 써두시다니요 ;;;; 개 존맛 앉은 자리에서 한번에 3개 이상 가능한 바나나 케이크 라고 고쳐주세요 어디서나 먹을 수 있는 평범한 바나나 파운드 일거라 생각한 제 자신이 한심스러워지는 순간입니다 어떤 음료든 잘 어울릴 것 같네요 안에 견과류가 들...$$분위기+숨겨져있는 묘미!$$을지로에 있어서 찾아가기는 좀 힘든 편인데 조용하고 분위기도 좋았어요! 바나나브레드랑 아인슈페너 둘 다 맛있었습니당 :-) $$$$분위기 좋은 커피집 찾기 어렵지만 뭔가 "나만 아는 카페" 느낌이라 좋다$$찾아가는 길이 꽤나 헷갈렸지만, 그 맛에 을지로 카페 가는거니까요. 분위기도 커피맛도 좋았습니다.$$$$왕짱맛 바나나케익. 농담아니고 진짜진짜진짜 맛있어요 하나 다 먹고 바로 접시 갖다드리면서 하나 더 시킴.$$분위기가 너무 좋아요~~ 아인슈페너 커피 산미가 아주 강해요 산미있는거 안젛아하지만 그래도 크림이랑 어울리게 맛있네요$$라떼 참 맛있었는데 롤케이크에서 진짜 실망해서 별 깎음.  아무리 직접 만들어파는게 아니여도 이렇게 얼음덩어리 그대로 딱딱한걸 내어주다니... 환불하고 싶었지만 커피 맛있어서 참음.  그림 많고 구경할거 많고 재밌다$$드립커피가 맛있고 공간이 널직해서 휴식하기에 좋음$$오래오래 있어주세요! 오늘 너무 즐거웠습니다$$아인슈페너 크림이 참 곱고 맛납니다. 원두는 신맛이 강해요!$$굿굿 주말에가서 만석이긴 했지만 분위기좋고 커피 맛있어요 드립커피라 시간이 조오오금 마아않이 걸리긴하지만(사람 많아서 더 그런듯) 비엔나커피 먹었는데 맛있습니다 흑흑$$찾아가는 재미가 있어요! 을지로에 숨겨진 카페ㅎㅎ 커피도 맛있고 작품들 보는 재미도 있어요! 을지로가면 꼭 가보세요.$$$$Brewing Coffee Only$$일러스트 작가의 작업공간도 있는 카페라는 점에서도 독특하고, 개성 넘치는 카페인 거 같습니다. 작품도 다 예쁘고 구경하는 재미가 있네요 :)
2128655244|로이터 커피셸터|$$대로변에서 들어가야 합니다. 지도에 위치가 잘 못 표기 됐네요. 아메리카노는 바디감은 적고 산미가 있는 편입니다.  매장은 쾌적하고 편안한 분위기입니다. 다만 울림이 좀 있습니다.$$장소가 다했음!$$루프탑은 인왕산도 보이고 진짜 오래된 느티나무가 한쪽에 있어 휴양지 느낌. 당근케이크도 맛있고 넓고 쾌적해서 남산 올때마다 갑니다$$Not bad~$$분위기는 좋으나 비쌈 $$테라스 뷰는 나쁘지 않은데 일반적으로 한국 카페에서 기대할 수 있는 것들이 전혀 없다. 예를 들면 충전 콘센트… 좋은 접근성… 다양한 메뉴…$$$$직원분들 너무 친절하고 내부도 깔끔해요! 커피도 맛있구요:)$$$$wifi: loiterliving 공간 넓음 위층 테라스 시설관리는 안되고 탁트임은 남산낀 카페쳐도 괜찮야 음료/디저트: 1500-2000원선 수준.  해질쯤 바람불면 매우 괜찮아$$루프탑이 예뻐서 좋고 카페 자체도 넓고 쾌적함 음료랑 디저트는 걍 그럼...... 하지만 공간이 마음에들어서 자주 갈 예정$$굿$$주말에 이곳에 방문하실 분은 반드시 대중교통을 이용하거나, 경차 같은 작은 차를 가지고 가셔야 합니다. 20년 운전경력에 이 곳 처럼 주차하기 불편한 카페나 음식점은 처음입니다. 공영주차장 지하 입출차하는 곳 코너 벽에 다른 차량들이 긁은 흔적이 무수히 많이 있더군요.$$찾아가는데 좀 힘들었어요 그래도 커피가 맛있어서 좋았네요$$$$공간 자체가 예쁨$$the drink wasn’t my favorite but go for the atmosphere and the VIEWS—the rooftop view of namsan can’t be beat. the interior is also stunning and you can tell the owner put a lot of thought into design...$$고소하고 긴 여운이 좋았어요 $$주차도 편하고 남산뷰도 좋아요$$$$$$여유롭게 커피한 잔 하기 좋은 곳 ! $$사진맛집 카페! 여기저기 사진 찍기 좋음 에이드 메뉴가 많이 없어서 아쉽지만 대체적으로 만족$$루프탑에서 보는 주변 경치 굿굿$$가야는이유 : 휴양지와 힙한 느낌을 고루 갖춘, 전망 안가는이유 : 좋은 원두들임에도 맛은 기대보단 별로  듁스커피 위주에 놈코어블렌드와 나무사이로 디카페인도 사용하나 쇼룸에서 먹었던 것보다 별로 대중교통이 없는 오르막에 있어 차가 있으면 좋으나 같은 건물 예식과 겹칠 시 주차 어려울 수 있음$$시그니처메뉴 로이터커피? 마셨는데 조금 느끼해요 매장 인테리어도 세련되고 직원분들이 친절하셔서 좋음 루프탑 경치도 좋습니다 ~!$$카페는 좋은데 주말에 갔더니 아래 예식장때문에 주차는 길에 해야한다해서 길에 했는데 한참후에 예식장 발렛하시는분이 전화오셔서 내려갔더니 차키 주고 가라해서 드리고 잠시후에 내려가서 키 찾으니 차는 처음 그자리 그대로 있고 키는 차에 있다해서 뭐지?하며 갔더니 차문열려있고 내리막길에서 사이드 내려가있고 ; 누가 차에서 뭐 훔쳐가거나 내리막에서 사이드 안걸려있...$$
1062422741|루프트 명동점|$$자리 넓고 쾌적하니 좋음. 커피 가장 산미 없는 서울로 마셔봤는데 별로.... 아메리카노 5900으로 올랐어요...  영업시간 19:00까지임$$좋아요$$©2021. ethwang All rights reserved. $$자리 넓고 커피맛도 나쁘진 않음. 알바분 말고 사장인지 매니저인지 여자 직원은 불친절함. 손님 귀찮아함.$$$$커피도 맛있고 직원?사장님?이 엄청 친절하세요!$$다들 커피 맛있다고 칭찬함. 아인슈페너 생각보다 작아서 놀랐고 빵보단 커피가 훨 나은 집인듯$$넓고 탁 트였고 커피컵 디자인이 너무 예뻐요 라떼가 존맛$$커피 맛있어요~~ 서비스가 좋아요$$빵은 그냥 그랬는데 커피가 진짜 맛있네요. ‘서울’ 커피 원두도 사왔어요. 커피 생각나서 또 갈듯! $$$$good job$$좋아요 커피좋아하는 사람은 여기 커피 꼭 먹어봐요!! 커피추출을 잘 뽑아냈어요!!$$와이파이도 안되고 콘센트도 안되고 해결 할려는 의지도 없고 아이스커피를 종이컵에 주는걸 봐선 커피에 대한 미학이 없다고 봄. 비추천$$명동 오면 자주 들르는 곳. 넓고 좋음. 아메도 원두 선택이라 굿.$$비싼데 커피 맛있어요 !!! 베이커리 종류 많아서 좋구요. 크로와상 샌드위치 단종되서 슬픔 $$$$$$커피는 쏘쏘 가격은 좀 비싸유. 위생은 좀 아닌듯...직원들 모자라도 썼으면...원두호퍼뚜껑은 왜 열어놓는지 $$Great as a place for instagram pictures. Coffee tastes great and the cafe is beautiful but the seating is not very comfortable. Prices are quite reasonable.$$.$$인테리어 : 깔끔해서 예쁘다 가격 : 싼건아님 인테리어가 내취향이라 나쁘진않다 단점 : 음악. 인테리어랑 그닥 안어울림
47806106|분카샤 을지로점|$$맛 없고 , 양 적은데 비쌉니다. 그렇다고 분위기가 좋거나 인테리어가 예쁜 것도 아니에요. 자리도 이상합니다. 테이블과 의자가 구분이 안 되게 똑같이 생겼고 물론 높이도 똑같으니 불편하겠죠. 가실 분들은 참고하세요.$$순두커피 진짜 맛있네요 생크림 완전 내 스타일 후르츠산도도 엄청 맛있는데 빨리 먹어져서(?) 아쉬움.. 일단 둘 다 생크림이 미쳤어요ㅠㅠ 2019년도 후기는 안 좋길래 걱정했는데 걱정할 필요 없이 훌륭한 맛이었습니다 :) 재방문의사 1000%$$케잌 테이크아웃해서 근처 도보로 행2pm8pm 와인바 가서 공연봣어요 (케이크 반입되는곳임) 친구추천으로 두곳 을지로 코스 너무 즇아요!!!$$$$후르츠샌드는 넘맛있음  산도라고 하는건 별로지만.. 을지로치고 화장실도 괜찮고  직원분 친절도도 나쁘지않음 그러나 의자가 너무너무너뮤 불편함  의자 테이블 높이가 동일함ㅋㅋ
1435193216|는커피|$$나뿌지 않았어용$$호흡기 감염은 코 점막과 구강에서 감염되고 옮깁니다. 백신은 여기에 영향을 끼치지 않아요.근거는 감기입니다. 같은 호흡기 바이러스 형식인 감기도 인류가 여태 못 잡았는데 몇 개월 만에 만든 백신으로 호흡기 바이러스를 막을 수 있다고 생각하시나요? 확진자 3만이 넘어가는데 이게 다 미접종자 탓인가요?   미접이 퍼트린다는 식으로 말씀하시고 미접 1인 안 받으...$$아아 - 다크초코같은 묵직한 맛. 산미 없음. 얼음이 반이라 음료를 느리게마시는 편인데도 순식간에 다 마심 아바라 - 많이 달음 직원이 한분계셨는데, 주문 받는것도 소진된 메뉴에 대한 안내도 바빠죽겠는데 번거롭게한다는 듯이 짜증내면서 말씀하셔서 좀… 다른 분이 근무하실때만 가게될듯$$아인슈페너 맛집. 크림이 정말 쫀쫀하고 커피도 고소하고 쓰지않아서 좋아요! 이번에 첨 왔는데 다음에 또 올거에요.$$탕약 맛 나는 커피를  별로 좋아하지 않는데 그렇다고 과할 정도는 아니고 좀 묵직한 커피를 좋아하시는 분들은 괜찮을 듯.. 개인적으로 커피 맛은 옆 집 type이 제 입 맛에 맞습니다.
1524619494|커피그래|$$아메리카노 맛있어서 이만원치 포장해갑니다! 카페도 넘 예쁘고 사장님 친절하셔서 좋았어요$$바나나푸딩에 쿠키부분이 너무 많은 느낌. 드립 맛잇음. $$약수에서 가장 좋은 로스터리$$크로플이랑 쿠키 맛있어요! 음료도 괜찮았어용 ㅎㅎ 사장님(여자분) 친절하세요$$사장님인지 직원분인지 모르겠지만 안경쓰신 남자분은 손님 응대에 친절할 필요가 있는 것 같네요…
380897959|계단집|$$직원분이 너무 친절함 화장실 구옥인데도 넓고 깨끗하고 따뜻한물까지나옴 심지어 지리게맛있음 번창하세요$$사장님이 너무 친절하셨던…!$$여름에 갔었는데 음료가 특이하고 맛있었음 사람이 너무 많았던거 이해는 하는데 자리가 넘 좁아서 다시 가고싶진 않음$$Coffee$$$$$$인절미 와플 열개도 먹을 수 잇어..!!!!! ♡⁺◟(●˙▾˙●)◞⁺♡ $$굉장히 친절하시구 맛도 좋아요!  공간이 되게 아기자기하면서도 ,, 따뜻하고,,  귀여워요  저는 한 번 가 본 걸로 맨족합니다 후후 $$아늑하고 친절하고 맛있는 커피에 행복해지는 공간 비건 디저트도 있어요! 가게 이름처럼 계단이 많아 쟁반을 들고 오를 때나, 어린이는 조심해야 할 것 같아요$$$$맛 3 맛은 평이했음  가격 2.5 대체적으로 평이했지만 구성이나 맛에 비해 과하다고 느껴지는 메뉴들이 있었음  인테리어/뷰 4 계단을 꽤 올라야 입구가 보여 무릎 안좋으신 어르신들께는 비추천. 뷰는 확 트이지는 않고 앞에 건물들이 가리고 있지만 해질녘 일몰과 동네 고양이의 선탠 등 고즈넉한 분위기를 느낄 수 있음. 인테리어는 평이~2층이 더 깔끔하고 정돈...$$회현동. 주택 사이에 위치한 분위기 좋은 카페. 아지트 같은 느낌이라 참 좋음. 단, 자리가 많지 않아요.$$내부 인테리어도 좋고 친절하시고 음료도 맛있습니다.특히 차가 좋습니다. 하지만 올라가기 너무 힘이드네요.$$가야는이유 : 적산가옥을 커뮤니티카페로 개조한, 외경과 2층이 멋있어 사진찍고 싶은 안가는이유 : 1년여간 준비하신 주민바리스타들이 운영하시지만 친절함에 비해 맛과 운영은 아쉽$$나만 알고싶은 카페. 분위기도 맛도 너무 좋아요$$커피맛...상당히 훌륭했습니다.$$찾아가기 난이도 높은편 맞는거같아요..그래도 만족$$나만 알고싶은 까페 (찾아가는 난이도 높은편)
385848168|mwm|$$$$크로플 맛있음(아이스크림 필수) we blend 커피.. 개맛있네요$$커피 맛있음 한적하고 분위기 좋음 $$커피도 맛잇구 인센스 홀더들도 너무 귀여워요$$
610993395|피어커피 광희문점|$$$$$$$$바리스타 분들의 친절한 설명 그리고 왠지모를 마음의 편안함. 좋은 기억에 감사합니다.$$친절하고 맛있는 커피 센스와 분위기는 덤$$느림의 미학  맛나요 $$청구역이랑 아무 연고도 없는데 순수하게 커피마시러 왔어요 와서 일하시는분 친절함에 감동받고 커피맛에 2차로 감탄하고 갑니다 다음에 원두사러 또 가려고요 진짜 친절과 배려가 몸에 배신 분들이예요 배워갑니다.. 그리고 지붕도 멋있고 화장실도 깔끔 그자체입니다$$커피랑 디저트류 다 맛있어요 모던함과 전통을 섞은 인테리어 포근하고요  다만 내부가 좁아서 좌석이 몇개없고 코로나ㅜㅜ 조심해야겠어요 직원분들 친절하셨지만, 먹다가 급하게 전시회 기다리는거 호출와서 케이크 포장 요청했는데 직원분이 포장용기가 없다고 종이에 감싼 케이크 그대로 주길래 당황…!!ㅋㅋㅋㅋ(제가 음료비닐에 담아달라고 요청…) 그분은 일한지 얼마안되서...$$$$맛있게 잘 마셨습니당$$$$조아요$$맛있어요 :)$$맛있어요. 분위기 좋고 깨끗합니다$$맛있는커피.친절하다능$$최애 카페 직원분들 친절하고 가게 깔끔하고 커피 맛있오요$$2021 블루리본 획득. 광희문과 청구역 가는 조용한 길에 있는 진짜 미니멀해 보이지만 2층도 있는 듯?$$$$$$직원분 응대가 인상적입니다. 커피도 너무 맛있네요. 기분 좋아지는 곳입니다.$$분위기 좋음. 정말 조용함. 친절.$$매장도 깔끔하고 조금 외진곳에 있어서 조용하니 좋았어요 커피맛이 진짜 최고예요 산미 있으면서 부드러운 커피 찾기 힘든데 정말 맛있었어요 다 좋지만 그중에서도 콜드블루가 제일 맛있는것 같아요$$에스프레소가 물이 너무 많다고, 말씀 드리니 다시 한번 내주셔서 감사하긴 했는데요. 에스프레소라는 메뉴는 안하심이 어떨까 하고 오지랖 떨어봅니다. 콩과 로스팅은 충분히 좋아 보이는데, 드립과 라떼, 뜨아, 아아만 하시면 좋을 것 같습니다. 에스프레소는 다른 잘하는 곳을 보시고 연구 충분히 해서 메뉴로 내어주시면 어떨까요. 여러모로 친절하시고 공간도 좋은데 ...$$바닐라 라떼는 좀 달았어요$$커피 너무 맛있고요 1층 자리에서 보이는 입구 쪽 풍경이 계속 생각나요!$$친절하고 맛있고 오래오래 해주세요$$한적한 한양도성길에 새로생긴거 보고 와봐야지 하다가 이제 와봤네요. 피어니까 무조건 맛있을거라 생각하긴 했지만 커피 너무너무 맛있어요! 디저트도 맛있고요! 분위기까지 다했어요! 그리고 기분 좋아지는 피어스탭분들의 친절함과 전문성까지...이제 자주갈거에요 !! 최고최고$$공간이 너무 예뻐요.. 근처에 있다면 자주가고싶습니다. 직원분들도 친절하시고 .. 커피 진짜 맛있어요 !! 라떼 샷추가 필수 !! $$고즈넉한 주변 분위기와 커피 모두 마음에 들었습니다$$바리스타님들 너무 친절하세요. 특히 안경쓰신 분! 이것저것 섬세하게 설명해주시고 챙겨주셔서 감사했습니다. 다이애나 블렌딩 최고최고!$$주말의 여유를 만끽할 수 있었던 곳. 친절한 바리스타님이 커피에 대한 설명을 정성껏 해주신다. 2층 자리가 햇빛도 들고 깔끔해서 머물기에 좋았다. 산뜻한 베리향의 예가체프외 꾸덕한 초콜릿 쿠키를 먹었는데, 각각 특색이 있었다.$$체고$$완벽하지 않은 날 완벽한 느낌을 잠시나마 느낄 수 있는 곳$$맛 친절도 위치 인테리어 분위기 모두 좋네요. $$드립커피 짱. 주인분도 넘넘 친절쓰$$아이스 디카페인 아메리카노. 완벽. 세상에 이런 맛있는 디카페인커피라니...  물론 기본커피도 맛있음.$$커피 맛있고 공간도 아늑해서 좋았어요$$되게 아무것도 없는곳에 위치해있지만 오히려 그게 장점인 것 같다 찾아가볼만한 곳 맛도 좋고 분위기도 취저 자리는 협소한편이지만 1,2층 공간이 나뉘어져 있어 다양한 분위기를 느낄 수 있음 $$$$원두 두 종류 모두 맛있네요. 오랜만에 괜찮은 아메리카노 마셔서 기분이 좋았어요. 디저트도 맛있습니다. 무엇보다 공간이 1,2 층으로 나누어져 있고 인테리어가 깔끔해서 좋았습니다! 화장실도 엄청 청결해요$$맛있고 분위기도 좋네요. $$구석진 위치가 조금 아쉽지만 깔끔한 커피와 디저트 널찍한 내부가 마음에 드는 곳  2020.06.25$$맛 > 분위기 > 위치$$예쁘기도 하지만 커피맛이 너무 좋아요~:) 분위기도 분위기며, 맛도 좋은 곳입니다.
893424676|한옥카페|$$2층 분위기 있음 일하는 직원은 별로$$커피맛이 편차가 좀 심한편입니다. 간혹 미리뽑아놓은 샷을 부어서 주시거나, 탬핑, 예열에 문제가 있는지는 모르겠지만 크레마가 전혀 안나오는 샷이 나오는 경우도 있더라구요. 원두자체가 맛 없는건 아닌거같은데 추출과정에서 향미를 잃는 것 같아 조금 아쉬움이 남네요. 보실지는 모르겠지만 이 부분 조금 신경써주셨으면 좋겠습니다. $$시나몬 빵 맛있네요  굳굳$$아침시간 알바생 되게 불친절 하네요 두 명 있었는데 주문받는것도 그렇고 커피 줄때도 벨 줘놓고 아이스아메리카노하나요 이딴식으로 부르길래 벨이 안울리니까 당연히 내꺼 아닌줄 알고  앉아있었더니 커피안가져가냔식으로 퉁명스럽게 말하네요 벨을 왜줍니까 그럼? 일하기싫으면 출근을 하질 말던가 알바때매 아침부터 기분 더럽게하네$$분위기있고 한적함
